Title,Year,Rated,Released,Runtime,Genre,Director,Writer,Actors,Plot,Language,Country,Awards,Ratings,Metascore,imdbRating,imdbVotes,imdbID,Type,DVD,BoxOffice,Production,Website,Response
P.S.,2004,R,10 Feb 2005,97 min,"Comedy, Drama, Fantasy, Romance",Dylan Kidd,"Helen Schulman (novel), Helen Schulman (screenplay), Dylan Kidd (screenplay)","Laura Linney, Gabriel Byrne, Lois Smith, Paul Rudd",An unfulfilled divorced woman gets the chance to relive her past when she meets a young man who appears to be her high school sweetheart who died many years before.,English,USA,3 wins & 4 nominations.,"[{'Source': 'Internet Movie Database', 'Value': '6.1/10'}, {'Source': 'Rotten Tomatoes', 'Value': '54%'}, {'Source': 'Metacritic', 'Value': '55/100'}]",55,6.1,"5,812",tt0380609,movie,08 Feb 2005,"$119,241",Newmarket Films,N/A,True
Red Dust,2004,R,06 May 2005,110 min,Drama,Tom Hooper,"Troy Kennedy-Martin (screenplay), Gillian Slovo (novel)","Jamie Bartlett, Hilary Swank, Ian Roberts, Chiwetel Ejiofor","Police officer Dirk Hendricks (Bartlett) files an amnesty application for Alex Mpondo (Ejiofor), a member of the South African Parliament who can't remember the torture he once endured as a captive political activist. South African-born attorney Sarah Barcant (Swank), meanwhile, returns to her homeland to represent Mpondo, as well as Steve Sizela, Mpondo's friend who was arrested along with him ...","English, Xhosa, Afrikaans","UK, South Africa",4 wins & 2 nominations.,"[{'Source': 'Internet Movie Database', 'Value': '6.9/10'}]",N/A,6.9,"2,078",tt0388364,movie,25 Jul 2006,N/A,HBO,N/A,True
Innocence,2004,R,12 Jan 2005,122 min,"Drama, Mystery",Lucile Hadzihalilovic,"Lucile Hadzihalilovic, Frank Wedekind (novel)","Zoé Auclair, Lea Bridarolli, Bérangère Haubruge, Marion Cotillard",A look inside an offbeat boarding school for young girls.,French,"Belgium, France, UK, Japan",8 wins & 2 nominations.,"[{'Source': 'Internet Movie Database', 'Value': '6.8/10'}, {'Source': 'Rotten Tomatoes', 'Value': '71%'}, {'Source': 'Metacritic', 'Value': '78/100'}]",78,6.8,"5,381",tt0375233,movie,13 Nov 2007,N/A,Mars Distribution,N/A,True
Saving Face,2004,R,24 Jun 2005,91 min,"Comedy, Drama, Romance",Alice Wu,Alice Wu,"Michelle Krusiec, Joan Chen, Lynn Chen, Jin Wang",A Chinese-American lesbian and her traditionalist mother are reluctant to go public with secret loves that clash against cultural expectations.,"English, Mandarin, Shanghainese",USA,3 wins & 3 nominations.,"[{'Source': 'Internet Movie Database', 'Value': '7.4/10'}, {'Source': 'Rotten Tomatoes', 'Value': '86%'}, {'Source': 'Metacritic', 'Value': '65/100'}]",65,7.4,"9,251",tt0384504,movie,18 Oct 2005,"$1,000,385",Sony Pictures Classics,N/A,True
,,,,,,,,,,,,,,,,,,,,,,,False
Kak snimalsya 'Nochnoy dozor',2004,N/A,17 Jul 2004,30 min,Documentary,N/A,N/A,"Konstantin Khabenskiy, Sergey Lukyanenko, Timur Bekmambetov, Rimma Markova",N/A,Russian,Russia,N/A,"[{'Source': 'Internet Movie Database', 'Value': '4.8/10'}]",N/A,4.8,24,tt0420708,movie,N/A,N/A,N/A,N/A,True
Veer-Zaara,2004,Not Rated,12 Nov 2004,192 min,"Drama, Family, Musical, Romance",Yash Chopra,"Aditya Chopra (dialogue), Aditya Chopra (screenplay), Aditya Chopra (story)","Shah Rukh Khan, Preity Zinta, Rani Mukerji, Kiron Kher","Veer-Zaara is a saga of love, separation, courage and sacrifice. A love story that is an inspiration and will remain a legend forever.","Hindi, Urdu, Punjabi",India,21 wins & 29 nominations.,"[{'Source': 'Internet Movie Database', 'Value': '7.8/10'}, {'Source': 'Rotten Tomatoes', 'Value': '92%'}, {'Source': 'Metacritic', 'Value': '67/100'}]",67,7.8,"45,871",tt0420332,movie,26 Feb 2005,"$2,856,738",Yash Raj Films Pvt. Ltd.,N/A,True
Calvaire,2004,Not Rated,09 Mar 2005,88 min,Horror,Fabrice du Welz,"Romain Protat, Fabrice du Welz","Laurent Lucas, Brigitte Lahaie, Gigi Coursigny, Jean-Luc Couchard","Marc, a traveling entertainer, is on his way home for Christmas when his van brakes in the middle of a jerkwater town with some strange inhabitans.",French,"Belgium, France, Luxembourg",4 wins & 3 nominations.,"[{'Source': 'Internet Movie Database', 'Value': '6.2/10'}, {'Source': 'Rotten Tomatoes', 'Value': '44%'}, {'Source': 'Metacritic', 'Value': '52/100'}]",52,6.2,"10,772",tt0407621,movie,03 Oct 2006,N/A,Palm Pictures,N/A,True
,,,,,,,,,,,,,,,,,,,,,,,False
,,,,,,,,,,,,,,,,,,,,,,,False
Eating Out,2004,Unrated,24 Feb 2012,90 min,"Comedy, Drama, Romance",Q. Allan Brocka,Q. Allan Brocka,"Rebekah Kochan, Scott Lunsford, Jim Verraros, Natalie Burge","After getting dumped by his slutty girlfriend, Caleb falls in love with Gwen. However, thanks to Caleb's roommate, Gwen thinks he's gay and sets him up with her roommate, Marc.",English,USA,6 wins.,"[{'Source': 'Internet Movie Database', 'Value': '5.8/10'}, {'Source': 'Rotten Tomatoes', 'Value': '16%'}, {'Source': 'Metacritic', 'Value': '28/100'}]",28,5.8,"5,723",tt0372884,movie,26 Jul 2005,N/A,Ariztical Entertainment,N/A,True
Little Black Book,2004,PG-13,06 Aug 2004,107 min,"Comedy, Romance, Drama",Nick Hurran,"Melissa Carter (story), Melissa Carter (screenplay), Elisa Bell (screenplay)","Brittany Murphy, Holly Hunter, Kathy Bates, Ron Livingston","A woman snoops through her boyfriend's palm pilot and reveals his former girlfriends, which causes her to question why they're still listed in his little black book.",English,USA,1 nomination.,"[{'Source': 'Internet Movie Database', 'Value': '5.3/10'}, {'Source': 'Rotten Tomatoes', 'Value': '22%'}, {'Source': 'Metacritic', 'Value': '36/100'}]",36,5.3,"16,770",tt0361841,movie,04 Jan 2005,"$20,422,207",Sony Pictures,N/A,True
Deux frères: La grande aventure,2004,N/A,01 Nov 2004,N/A,Adventure,Dominique Cheminal,N/A,N/A,N/A,French,France,N/A,[],N/A,N/A,N/A,tt0454597,movie,N/A,N/A,N/A,N/A,True
The Life and Death of Peter Sellers,2004,Not Rated,01 Oct 2004,122 min,"Biography, Comedy, Drama, Romance",Stephen Hopkins,"Roger Lewis (book), Christopher Markus (teleplay), Stephen McFeely (teleplay)","Geoffrey Rush, Charlize Theron, Emily Watson, John Lithgow",The feature adaptation of Roger Lewis' book about the actor best remembered as Inspector Clouseau in the Pink Panther movies.,English,"USA, UK",Won 2 Golden Globes. Another 29 wins & 34 nominations.,"[{'Source': 'Internet Movie Database', 'Value': '6.9/10'}, {'Source': 'Rotten Tomatoes', 'Value': '69%'}]",N/A,6.9,"14,088",tt0352520,movie,10 May 2005,N/A,Home Box Office,N/A,True
Maria Full of Grace,2004,R,06 Aug 2004,101 min,"Crime, Drama",Joshua Marston,Joshua Marston,"Catalina Sandino Moreno, Virgina Ariza, Yenny Paola Vega, Rodrigo Sánchez Borhorquez",A pregnant Colombian teenager becomes a drug mule to make some desperately needed money for her family.,"Spanish, English","Colombia, Ecuador, USA",Nominated for 1 Oscar. Another 41 wins & 33 nominations.,"[{'Source': 'Internet Movie Database', 'Value': '7.4/10'}, {'Source': 'Rotten Tomatoes', 'Value': '97%'}, {'Source': 'Metacritic', 'Value': '87/100'}]",87,7.4,"33,002",tt0390221,movie,07 Dec 2004,"$6,517,198",New Line Cinema,N/A,True
,,,,,,,,,,,,,,,,,,,,,,,False
Grande école,2004,N/A,04 Feb 2004,110 min,"Drama, Romance",Robert Salis,"Robert Salis (scenario), Jean-Marie Besset (scenario), Jean-Marie Besset (play)","Grégori Baquet, Alice Taglioni, Jocelyn Quivrin, Élodie Navarre",Paul and Agnes have been going out for quite a while and Agnes is shocked to learn that he'd rather live with two roommates on campus than move in with her. As soon as he meets one of his ...,French,France,1 nomination.,"[{'Source': 'Internet Movie Database', 'Value': '5.7/10'}]",N/A,5.7,"2,111",tt0340137,movie,09 Nov 2004,N/A,N/A,N/A,True
It's All Gone Pete Tong,2004,R,27 May 2005,90 min,"Biography, Comedy, Drama, Music",Michael Dowse,Michael Dowse,"Paul Kaye, Beatriz Batarda, Kate Magowan, Mike Wilmot",A famous DJ in the Ibiza club scene finds the alcohol and drug-fueled party that is his life threatened by the progressive loss of his hearing.,English,"UK, Canada",11 wins & 9 nominations.,"[{'Source': 'Internet Movie Database', 'Value': '7.4/10'}, {'Source': 'Rotten Tomatoes', 'Value': '76%'}, {'Source': 'Metacritic', 'Value': '56/100'}]",56,7.4,"18,473",tt0388139,movie,20 Sep 2005,N/A,Matson Films,N/A,True
Envy,2004,PG-13,30 Apr 2004,99 min,Comedy,Barry Levinson,Steve Adams,"Ben Stiller, Jack Black, Rachel Weisz, Amy Poehler",A man becomes increasingly jealous of his friend's newfound success.,English,USA,3 nominations.,"[{'Source': 'Internet Movie Database', 'Value': '4.8/10'}, {'Source': 'Rotten Tomatoes', 'Value': '8%'}, {'Source': 'Metacritic', 'Value': '31/100'}]",31,4.8,"28,962",tt0326856,movie,28 Sep 2004,"$12,181,484",DreamWorks SKG,N/A,True
Stage Beauty,2004,R,29 Oct 2004,106 min,Drama,Richard Eyre,"Jeffrey Hatcher (play), Jeffrey Hatcher (screenplay)","Derek Hutchinson, Mark Letheren, Claire Danes, Billy Crudup",A female theatre dresser creates a stir and sparks a revolution in seventeenth century London theatre by playing Desdemona in Othello. But what will become of the male actor she once worked for and eventually replaced?,English,"UK, USA, Germany",3 wins & 1 nomination.,"[{'Source': 'Internet Movie Database', 'Value': '7.1/10'}, {'Source': 'Metacritic', 'Value': '64/100'}]",64,7.1,"9,585",tt0368658,movie,N/A,N/A,N/A,N/A,True
Mr 3000,2004,PG-13,17 Sep 2004,104 min,"Comedy, Drama, Romance, Sport",Charles Stone III,"Eric Champnella (story), Keith Mitchell (story), Eric Champnella (screenplay), Keith Mitchell (screenplay), Howard Michael Gould (screenplay)","Bernie Mac, Angela Bassett, Michael Rispoli, Brian White","Aging baseball star who goes by the nickname, Mr. 3000, finds out many years after retirement that he didn't quite reach 3,000 hits. Now at age 47 he's back to try and reach that goal.",English,USA,1 win & 5 nominations.,"[{'Source': 'Internet Movie Database', 'Value': '5.5/10'}, {'Source': 'Rotten Tomatoes', 'Value': '55%'}, {'Source': 'Metacritic', 'Value': '57/100'}]",57,5.5,"13,426",tt0339412,movie,01 Feb 2005,"$21,772,753",Buena Vista Pictures,N/A,True
Lakshya,2004,Not Rated,18 Jun 2004,186 min,"Action, Drama, Romance, War",Farhan Akhtar,"Javed Akhtar (dialogue), Javed Akhtar (screenplay), Javed Akhtar (story), Karan Kashyap (dialogue supervisor)","Amitabh Bachchan, Hrithik Roshan, Preity Zinta, Om Puri","An aimless, jobless, irresponsible grown man joins the army and matures into a battlefield hero.","Hindi, English",India,3 wins & 10 nominations.,"[{'Source': 'Internet Movie Database', 'Value': '7.9/10'}]",N/A,7.9,"18,349",tt0323013,movie,25 Jan 2005,"$700,085",Excel Entertainment,N/A,True
Somersault,2004,Not Rated,16 Sep 2004,106 min,"Drama, Romance",Cate Shortland,Cate Shortland,"Abbie Cornish, Damian de Montemas, Olivia Pigeot, Alex Babic","A young girl flees her hometown and arrives in the Australian Alps, where new experiences help her learn the differences between sex and love.",English,Australia,41 wins & 15 nominations.,"[{'Source': 'Internet Movie Database', 'Value': '6.7/10'}, {'Source': 'Rotten Tomatoes', 'Value': '83%'}, {'Source': 'Metacritic', 'Value': '73/100'}]",73,6.7,"7,019",tt0381429,movie,25 Jul 2006,N/A,Magnolia Pictures,N/A,True
Modigliani,2004,R,29 Sep 2004,128 min,"Biography, Drama",Mick Davis,Mick Davis,"Andy Garcia, Elsa Zylberstein, Omid Djalili, Hippolyte Girardot","The story of Amedeo Modigliani's bitter rivalry with Pablo Picasso, and his tragic romance with Jeanne Hebuterne.",English,"UK, Germany, Romania, France, Italy",2 nominations.,"[{'Source': 'Internet Movie Database', 'Value': '7.4/10'}, {'Source': 'Rotten Tomatoes', 'Value': '4%'}, {'Source': 'Metacritic', 'Value': '25/100'}]",25,7.4,"10,255",tt0367188,movie,27 Sep 2005,N/A,Innovation Film Group,N/A,True
Agent Cody Banks 2: Destination London,2004,PG,12 Mar 2004,100 min,"Action, Adventure, Comedy, Family, Romance, Sci-Fi",Kevin Allen,"Jeffrey Jurgensen (characters), Harald Zwart (story), Dylan Sellers (story), Don Rhymer (story), Don Rhymer (screenplay)","Frankie Muniz, Anthony Anderson, Hannah Spearritt, Cynthia Stevenson","With all-new gadgets, high-flying action, exciting chases and a wisecracking new handler, Derek (Anthony Anderson), Cody has to retrieve the device before the world's leaders fall under the evil control of a diabolical villain.",English,"USA, UK",N/A,"[{'Source': 'Internet Movie Database', 'Value': '4.5/10'}, {'Source': 'Rotten Tomatoes', 'Value': '14%'}, {'Source': 'Metacritic', 'Value': '32/100'}]",32,4.5,"13,262",tt0358349,movie,13 Jul 2004,"$23,222,861",MGM,N/A,True
P.S.,2004,R,10 Feb 2005,97 min,"Comedy, Drama, Fantasy, Romance",Dylan Kidd,"Helen Schulman (novel), Helen Schulman (screenplay), Dylan Kidd (screenplay)","Laura Linney, Gabriel Byrne, Lois Smith, Paul Rudd",An unfulfilled divorced woman gets the chance to relive her past when she meets a young man who appears to be her high school sweetheart who died many years before.,English,USA,3 wins & 4 nominations.,"[{'Source': 'Internet Movie Database', 'Value': '6.1/10'}, {'Source': 'Rotten Tomatoes', 'Value': '54%'}, {'Source': 'Metacritic', 'Value': '55/100'}]",55,6.1,"5,812",tt0380609,movie,08 Feb 2005,"$119,241",Newmarket Films,N/A,True
Red Dust,2004,R,06 May 2005,110 min,Drama,Tom Hooper,"Troy Kennedy-Martin (screenplay), Gillian Slovo (novel)","Jamie Bartlett, Hilary Swank, Ian Roberts, Chiwetel Ejiofor","Police officer Dirk Hendricks (Bartlett) files an amnesty application for Alex Mpondo (Ejiofor), a member of the South African Parliament who can't remember the torture he once endured as a captive political activist. South African-born attorney Sarah Barcant (Swank), meanwhile, returns to her homeland to represent Mpondo, as well as Steve Sizela, Mpondo's friend who was arrested along with him ...","English, Xhosa, Afrikaans","UK, South Africa",4 wins & 2 nominations.,"[{'Source': 'Internet Movie Database', 'Value': '6.9/10'}]",N/A,6.9,"2,078",tt0388364,movie,25 Jul 2006,N/A,HBO,N/A,True
Innocence,2004,R,12 Jan 2005,122 min,"Drama, Mystery",Lucile Hadzihalilovic,"Lucile Hadzihalilovic, Frank Wedekind (novel)","Zoé Auclair, Lea Bridarolli, Bérangère Haubruge, Marion Cotillard",A look inside an offbeat boarding school for young girls.,French,"Belgium, France, UK, Japan",8 wins & 2 nominations.,"[{'Source': 'Internet Movie Database', 'Value': '6.8/10'}, {'Source': 'Rotten Tomatoes', 'Value': '71%'}, {'Source': 'Metacritic', 'Value': '78/100'}]",78,6.8,"5,381",tt0375233,movie,13 Nov 2007,N/A,Mars Distribution,N/A,True
Saving Face,2004,R,24 Jun 2005,91 min,"Comedy, Drama, Romance",Alice Wu,Alice Wu,"Michelle Krusiec, Joan Chen, Lynn Chen, Jin Wang",A Chinese-American lesbian and her traditionalist mother are reluctant to go public with secret loves that clash against cultural expectations.,"English, Mandarin, Shanghainese",USA,3 wins & 3 nominations.,"[{'Source': 'Internet Movie Database', 'Value': '7.4/10'}, {'Source': 'Rotten Tomatoes', 'Value': '86%'}, {'Source': 'Metacritic', 'Value': '65/100'}]",65,7.4,"9,251",tt0384504,movie,18 Oct 2005,"$1,000,385",Sony Pictures Classics,N/A,True
Undertow,2004,R,17 Dec 2004,108 min,"Drama, Thriller",David Gordon Green,"Lingard Jervey (story), Joe Conway (screenplay), David Gordon Green (screenplay)","Jamie Bell, Kristen Stewart, Robert Longstreet, Terry Loughlin","Following the death of his wife Audrey, John Munn moves with his two sons, mid-teen Chris Munn and adolescent Tim Munn, to a pig farm in rural Drees County, Georgia, where they lead a ...",English,USA,3 wins & 6 nominations.,"[{'Source': 'Internet Movie Database', 'Value': '6.6/10'}, {'Source': 'Rotten Tomatoes', 'Value': '55%'}, {'Source': 'Metacritic', 'Value': '63/100'}]",63,6.6,"8,077",tt0360130,movie,26 Apr 2005,N/A,MGM,N/A,True
,,,,,,,,,,,,,,,,,,,,,,,False
Machuca,2004,Not Rated,11 Jun 2004,121 min,"Biography, Drama, History",Andrés Wood,"Eliseo Altunaga, Roberto Brodsky, Mamoun Hassan, Andrés Wood","Matías Quer, Ariel Mateluna, Manuela Martelli, Aline Küppenheim",Two boys observe a political coup in their native Chile.,"Spanish, English","Chile, Spain, UK, France",12 wins & 6 nominations.,"[{'Source': 'Internet Movie Database', 'Value': '7.7/10'}, {'Source': 'Rotten Tomatoes', 'Value': '89%'}, {'Source': 'Metacritic', 'Value': '76/100'}]",76,7.7,"10,366",tt0378284,movie,06 Mar 2007,N/A,Menemsha Films,N/A,True
Employee of the Month,2004,R,17 Jan 2004,97 min,"Comedy, Drama",Mitch Rouse,"Mitch Rouse, Jay Leggett","Matt Dillon, Steve Zahn, Christina Applegate, Andrea Bendewald","It just isn't David's day. First he gets fired at the bank, then his fiancee breaks up and throws him out of the house. The bank gets robbed and he gets shot. Twists follow.",English,USA,N/A,"[{'Source': 'Internet Movie Database', 'Value': '6.2/10'}, {'Source': 'Rotten Tomatoes', 'Value': '11%'}]",N/A,6.2,"9,177",tt0362590,movie,04 Jan 2005,N/A,LionsGate Entertainment,N/A,True
Jiminy Glick in Lalawood,2004,R,06 May 2005,90 min,"Comedy, Mystery",Vadim Jean,"Martin Short (character), Martin Short, Paul Flaherty, Michael Short","Martin Short, Jan Hooks, Linda Cardellini, Janeane Garofalo",Culture critic Jiminy Glick gets tied up in a murder case at the Toronto Film Festival.,English,"Canada, USA",3 nominations.,"[{'Source': 'Internet Movie Database', 'Value': '5.4/10'}, {'Source': 'Rotten Tomatoes', 'Value': '22%'}, {'Source': 'Metacritic', 'Value': '41/100'}]",41,5.4,"1,642",tt0347369,movie,04 Oct 2005,"$25,660",MGM/UA,N/A,True
Laws of Attraction,2004,PG-13,30 Apr 2004,90 min,"Comedy, Romance",Peter Howitt,"Aline Brosh McKenna (story), Aline Brosh McKenna (screenplay), Robert Harling (screenplay)","Pierce Brosnan, Julianne Moore, Michael Sheen, Parker Posey","Amidst a sea of litigation, two New York City divorce lawyers find love.",English,"Ireland, UK, Germany",2 nominations.,"[{'Source': 'Internet Movie Database', 'Value': '5.9/10'}, {'Source': 'Rotten Tomatoes', 'Value': '18%'}, {'Source': 'Metacritic', 'Value': '38/100'}]",38,5.9,"21,204",tt0323033,movie,24 Aug 2004,"$17,848,322",New Line Cinema,N/A,True
Riding the Bullet,2004,R,03 Feb 2005,98 min,"Horror, Thriller",Mick Garris,"Mick Garris (screenplay), Stephen King (novel)","Jonathan Jackson, David Arquette, Cliff Robertson, Barbara Hershey","When a man finds out his mother is dying and tries to hitchike his way to the hospital, he is picked up by a stranger with a deadly secret.",English,"USA, Germany, Canada",1 nomination.,"[{'Source': 'Internet Movie Database', 'Value': '5.2/10'}, {'Source': 'Rotten Tomatoes', 'Value': '26%'}, {'Source': 'Metacritic', 'Value': '37/100'}]",37,5.2,"8,685",tt0355954,movie,19 Apr 2005,"$101,107",LionsGate Entertainment,N/A,True
,,,,,,,,,,,,,,,,,,,,,,,False
Five Children and It,2004,Not Rated,15 Oct 2004,89 min,"Adventure, Family, Fantasy",John Stephenson,"David Solomons, E. Nesbit (novel)","Tara Fitzgerald, Freddie Highmore, Alex Jennings, Jonathan Bailey",Five children staying in their eccentric uncle's labyrinthine mansion for protection during World War I befriend a sand fairy who has the power to grant wishes.,English,"France, UK, USA",2 wins.,"[{'Source': 'Internet Movie Database', 'Value': '5.5/10'}, {'Source': 'Rotten Tomatoes', 'Value': '63%'}]",N/A,5.5,"4,707",tt0366450,movie,05 Jul 2005,N/A,Capitol Films,N/A,True
,,,,,,,,,,,,,,,,,,,,,,,False
Barbershop 2: Back in Business,2004,PG-13,06 Feb 2004,106 min,"Comedy, Drama",Kevin Rodney Sullivan,"Mark Brown (characters), Don D. Scott","Ice Cube, Cedric the Entertainer, Sean Patrick Thomas, Eve","The owner of an historic South Side Chicago barbershop is pressured to sell out to a land developer, but must face the impact this would have on his close-knit community.",English,USA,2 wins & 10 nominations.,"[{'Source': 'Internet Movie Database', 'Value': '5.7/10'}, {'Source': 'Rotten Tomatoes', 'Value': '69%'}, {'Source': 'Metacritic', 'Value': '59/100'}]",59,5.7,"13,564",tt0337579,movie,29 Jun 2004,"$64,955,956",MGM,N/A,True
Dear Frankie,2004,PG-13,15 Apr 2005,105 min,"Drama, Romance",Shona Auerbach,Andrea Gibb (screenplay),"Emily Mortimer, Jack McElhone, Mary Riggans, Sharon Small","After having responded to her son's numerous letters in the guise of his father, a woman hires a stranger to pose as his dad when meeting him.","English, British Sign Language",UK,8 wins & 8 nominations.,"[{'Source': 'Internet Movie Database', 'Value': '7.7/10'}, {'Source': 'Rotten Tomatoes', 'Value': '81%'}, {'Source': 'Metacritic', 'Value': '63/100'}]",63,7.7,"20,545",tt0377752,movie,05 Jul 2005,N/A,Miramax Films,N/A,True
Ek Hasina Thi,2004,N/A,02 Jan 2019,120 min,"Crime, Drama, Mystery, Thriller",Sriram Raghavan,"Sriram Raghavan, Pooja Ladha Surti","Saif Ali Khan, Urmila Matondkar, Seema Biswas, Aditya Srivastava","A woman falls for a charming and mysterious businessman. The whirlwind romance turns sour when she is framed for his underworld crimes. Now, finally out of prison she is ready for sweet revenge.","Hindi, English",India,2 wins & 11 nominations.,"[{'Source': 'Internet Movie Database', 'Value': '7.6/10'}]",N/A,7.6,"5,894",tt0352314,movie,20 Dec 2005,N/A,N/A,N/A,True
Teacher's Pet,2004,PG,16 Jan 2004,73 min,"Animation, Adventure, Comedy, Family, Fantasy, Musical, Sci-Fi",Timothy Björklund,"Gary Baseman (television series Teacher's Pet), Bill Steinkellner (television series Teacher's Pet), Cheri Steinkellner (television series Teacher's Pet), Bill Steinkellner (screenplay), Cheri Steinkellner (screenplay)","Nathan Lane, Kelsey Grammer, Shaun Fleming, Debra Jo Rupp","Spot (Lane) is a dog who can talk and read. Posing as a human, he sneaks into school with his master Leonard (Flemming). Educational adventures ensue.",English,USA,2 nominations.,"[{'Source': 'Internet Movie Database', 'Value': '5.8/10'}, {'Source': 'Rotten Tomatoes', 'Value': '76%'}, {'Source': 'Metacritic', 'Value': '74/100'}]",74,5.8,"1,437",tt0350194,movie,15 Jun 2004,"$6,295,378",Buena Vista Pictures,N/A,True
Satan's Little Helper,2004,R,06 May 2004,96 min,"Comedy, Horror",Jeff Lieberman,Jeff Lieberman,"Alexander Brickel, Katheryn Winnick, Stephen Graham, Amanda Plummer",A naive young boy unknowingly becomes the pawn of a serial killer.,English,USA,3 nominations.,"[{'Source': 'Internet Movie Database', 'Value': '5.3/10'}]",N/A,5.3,"5,434",tt0380687,movie,04 Oct 2005,N/A,Screen Media Films,N/A,True
Imaginary Heroes,2004,R,10 Nov 2005,111 min,"Comedy, Drama",Dan Harris,Dan Harris,"Sigourney Weaver, Emile Hirsch, Jeff Daniels, Michelle Williams",The Travis family façade is destroyed by an event incomprehensible to them -- an event which will open locked doors and finally reveal the secrets that have haunted them for decades.,English,"USA, Germany, Belgium",1 win & 2 nominations.,"[{'Source': 'Internet Movie Database', 'Value': '7.2/10'}, {'Source': 'Rotten Tomatoes', 'Value': '34%'}, {'Source': 'Metacritic', 'Value': '53/100'}]",53,7.2,"9,172",tt0373024,movie,07 Jun 2005,N/A,Sony Pictures Classics,N/A,True
Dhoom,2004,Not Rated,27 Aug 2004,129 min,"Action, Crime, Thriller",Sanjay Gadhvi,"Vijay Krishna Acharya (dialogue), Vijay Krishna Acharya (screenplay)","Abhishek Bachchan, John Abraham, Uday Chopra, Esha Deol","A mysterious gang of bikers is on a robbing spree. ACP Jai gets Ali, a mechanic, to assist him in the case. With the clock ticking, it's up to them to nab the thieves red-handed.",Hindi,India,11 wins & 22 nominations.,"[{'Source': 'Internet Movie Database', 'Value': '6.7/10'}]",N/A,6.7,"16,630",tt0422091,movie,04 Aug 2009,N/A,Yashraj Films,N/A,True
,,,,,,,,,,,,,,,,,,,,,,,False
Girl Play,2004,Not Rated,11 Jul 2004,80 min,Comedy,Lee Friedlander,"Lee Friedlander, Robin Greenspan, Lacie Harmon","Robin Greenspan, Lacie Harmon, Mink Stole, Dom DeLuise","Two real-life lesbian actresses meet by chance when they are cast as lovers in a local stage play, and end up actually falling in love.",English,USA,10 wins.,"[{'Source': 'Internet Movie Database', 'Value': '4.7/10'}, {'Source': 'Rotten Tomatoes', 'Value': '25%'}, {'Source': 'Metacritic', 'Value': '37/100'}]",37,4.7,721,tt0416773,movie,16 Aug 2005,N/A,Wolfe Video,N/A,True
Melinda and Melinda,2004,PG-13,08 Apr 2005,99 min,"Comedy, Drama, Romance",Woody Allen,Woody Allen,"Wallace Shawn, Neil Pepe, Stephanie Roth Haberle, Larry Pine","Two alternating stories, one comedy and the other tragedy, about Melinda's attempts to straighten out her life.",English,USA,N/A,"[{'Source': 'Internet Movie Database', 'Value': '6.4/10'}, {'Source': 'Rotten Tomatoes', 'Value': '52%'}, {'Source': 'Metacritic', 'Value': '54/100'}]",54,6.4,"29,993",tt0378947,movie,25 Oct 2005,"$3,727,614",Fox Searchlight Pictures,N/A,True
Connie and Carla,2004,PG-13,16 Apr 2004,98 min,"Comedy, Crime, Music",Michael Lembeck,Nia Vardalos,"Nia Vardalos, Toni Collette, David Duchovny, Stephen Spinella","A mob mix-up in Chicago sends two chanteuses screaming for L.A., where they score a perfect gig: posing as drag queens on the dinner theater/cabaret circuit. Things get extra-weird when a guy falls for one of the girls.",English,USA,1 win.,"[{'Source': 'Internet Movie Database', 'Value': '6.2/10'}, {'Source': 'Rotten Tomatoes', 'Value': '44%'}, {'Source': 'Metacritic', 'Value': '44/100'}]",44,6.2,"7,618",tt0345074,movie,17 Aug 2004,"$7,976,065",Universal Pictures,N/A,True
,,,,,,,,,,,,,,,,,,,,,,,False
Palindromes,2004,Not Rated,21 Jan 2005,100 min,"Comedy, Drama",Todd Solondz,Todd Solondz,"Matthew Faber, Angela Pietropinto, Bill Buell, Emani Sledge","Aviva is thirteen, awkward and sensitive. Her mother Joyce is warm and loving, as is her father, Steve, a regular guy who does have a fierce temper from time to time. The film revolves around her family, friends and neighbors.","English, Hebrew",USA,3 nominations.,"[{'Source': 'Internet Movie Database', 'Value': '6.8/10'}, {'Source': 'Rotten Tomatoes', 'Value': '43%'}, {'Source': 'Metacritic', 'Value': '53/100'}]",53,6.8,"11,638",tt0362004,movie,13 Sep 2005,"$476,497",Wellspring,N/A,True
