Title,Year,Rated,Released,Runtime,Genre,Director,Writer,Actors,Plot,Language,Country,Awards,Ratings,Metascore,imdbRating,imdbVotes,imdbID,Type,DVD,BoxOffice,Production,Website,Response
What Doesn't Kill You,2008,R,10 Sep 2009,100 min,"Crime, Drama",Brian Goodman,"Brian Goodman, Paul T. Murray, Donnie Wahlberg","Mark Ruffalo, Ethan Hawke, Amanda Peet, Will Lyman","Two childhood friends from South Boston turn to crime as a way to get by, ultimately causing a strain in their personal lives and their friendship.",English,USA,1 nomination.,"[{'Source': 'Internet Movie Database', 'Value': '6.6/10'}, {'Source': 'Rotten Tomatoes', 'Value': '65%'}, {'Source': 'Metacritic', 'Value': '71/100'}]",71,6.6,"11,233",tt1133991,movie,28 Apr 2009,N/A,Yari Film Group,N/A,True
Max Manus: Man of War,2008,Not Rated,03 Sep 2010,118 min,"Action, Biography, Drama, History, War","Joachim Rønning, Espen Sandberg",Thomas Nordseth-Tiller,"Aksel Hennie, Agnes Kittelsen, Nicolai Cleve Broch, Ken Duken",The true story about one of the most brilliant saboteurs during World War II and his battle to overcome his inner demons.,"Norwegian, German, English, Russian, Finnish","Norway, Denmark, Germany",12 wins & 4 nominations.,"[{'Source': 'Internet Movie Database', 'Value': '7.3/10'}, {'Source': 'Rotten Tomatoes', 'Value': '79%'}, {'Source': 'Metacritic', 'Value': '60/100'}]",60,7.3,"25,103",tt1029235,movie,28 Jun 2011,N/A,Nordisk Film Biograf Distribution,N/A,True
,,,,,,,,,,,,,,,,,,,,,,,False
The Wackness,2008,R,01 Aug 2008,99 min,"Comedy, Drama, Romance",Jonathan Levine,Jonathan Levine,"Ben Kingsley, Josh Peck, Famke Janssen, Olivia Thirlby","It's the summer of 1994, and the streets of New York are pulsing with hip-hop. Set against this backdrop, a lonely teenager named Luke Shapiro spends his last summer before university selling marijuana throughout New York City, trading it with his unorthodox psychotherapist for treatment, while having a crush on his stepdaughter.",English,"UK, USA",4 wins & 4 nominations.,"[{'Source': 'Internet Movie Database', 'Value': '7.0/10'}, {'Source': 'Rotten Tomatoes', 'Value': '70%'}, {'Source': 'Metacritic', 'Value': '61/100'}]",61,7.0,"29,217",tt1082886,movie,06 Jan 2009,"$2,100,000",Sony Pictures Classics,N/A,True
Little Ashes,2008,R,08 May 2009,112 min,"Biography, Drama, Romance",Paul Morrison,Philippa Goslett,"Javier Beltrán, Robert Pattinson, Matthew McNulty, Marina Gatell","About the young life and loves of artist Salvador Dalí, filmmaker Luis Buñuel and writer Federico García Lorca.","English, Spanish","UK, Spain",1 win.,"[{'Source': 'Internet Movie Database', 'Value': '6.5/10'}, {'Source': 'Rotten Tomatoes', 'Value': '24%'}, {'Source': 'Metacritic', 'Value': '41/100'}]",41,6.5,"8,314",tt1104083,movie,26 Jan 2010,"$400,000",Regent Releasing,N/A,True
Make It Happen,2008,PG-13,08 Aug 2008,90 min,Drama,Darren Grant,"Duane Adler (screenplay), Nicole Avril (screenplay), Duane Adler (story)","Mary Elizabeth Winstead, Tessa Thompson, Riley Smith, John Reardon","Embarking on a journey to fulfill her dreams as a dancer, a young girl discovers a new style of dance that will prove to be the source of both conflict and self-discovery.",English,USA,N/A,"[{'Source': 'Internet Movie Database', 'Value': '5.4/10'}, {'Source': 'Rotten Tomatoes', 'Value': '22%'}]",N/A,5.4,"5,816",tt0822868,movie,09 Dec 2008,N/A,The Weinstein Co./MGM,N/A,True
Management,2008,R,15 May 2009,94 min,"Comedy, Drama, Romance",Stephen Belber,Stephen Belber,"Jennifer Aniston, Steve Zahn, Margo Martindale, Fred Ward",A traveling art saleswoman tries to shake off a flaky motel manager who falls for her and won't leave her alone.,"English, Mandarin",USA,N/A,"[{'Source': 'Internet Movie Database', 'Value': '5.8/10'}, {'Source': 'Rotten Tomatoes', 'Value': '47%'}, {'Source': 'Metacritic', 'Value': '50/100'}]",50,5.8,"16,558",tt1082853,movie,29 Sep 2009,"$809,787",IDP/Samuel goldwyn Films,N/A,True
The Square,2008,R,31 Jul 2008,105 min,"Crime, Drama, Thriller",Nash Edgerton,"Joel Edgerton, Matthew Dabner, Joel Edgerton (original story)","David Roberts, Claire van der Boom, Peter Phelps, Bill Hunter",A man's life begins to unravel when his mistress brings him a bag of cash.,English,Australia,2 wins & 15 nominations.,"[{'Source': 'Internet Movie Database', 'Value': '6.7/10'}, {'Source': 'Rotten Tomatoes', 'Value': '86%'}, {'Source': 'Metacritic', 'Value': '75/100'}]",75,6.7,"5,236",tt1085507,movie,24 Aug 2010,"$404,898",Apparition,N/A,True
Kit Kittredge: An American Girl,2008,G,02 Jul 2008,101 min,"Comedy, Drama, Family",Patricia Rozema,"Ann Peacock, Valerie Tripp (Kit Kittredge stories)","Abigail Breslin, Julia Ormond, Chris O'Donnell, Jane Krakowski","Set in Cincinnati at the height of the Great Depression, Kit Kittredge, a resourceful young girl, helps her mother run a boardinghouse after her father loses his job.",English,"USA, Canada",2 wins & 5 nominations.,"[{'Source': 'Internet Movie Database', 'Value': '6.5/10'}, {'Source': 'Rotten Tomatoes', 'Value': '80%'}, {'Source': 'Metacritic', 'Value': '63/100'}]",63,6.5,"5,350",tt0846308,movie,28 Oct 2008,"$17,533,514",Picturehouse,N/A,True
Jodhaa Akbar,2008,Not Rated,15 Feb 2008,213 min,"Action, Drama, History, Romance, War",Ashutosh Gowariker,"Haidar Ali (story), Haidar Ali (screenplay), Ashutosh Gowariker (screenplay), K.P. Saxena (dialogue), Rajshri Sudhakar (Dialogue Writer: Telugu)","Hrithik Roshan, Aishwarya Rai Bachchan, Sonu Sood, Poonam Sinha","A sixteenth century love story about a marriage of alliance that gave birth to true love between a great Mughal emperor, Akbar, and a Rajput princess, Jodha.","Hindi, Urdu",India,22 wins & 25 nominations.,"[{'Source': 'Internet Movie Database', 'Value': '7.6/10'}, {'Source': 'Rotten Tomatoes', 'Value': '75%'}, {'Source': 'Metacritic', 'Value': '69/100'}]",69,7.6,"27,508",tt0449994,movie,09 Sep 2008,N/A,UTV Communications,N/A,True
,,,,,,,,,,,,,,,,,,,,,,,False
Ong Bak 2,2008,R,04 Dec 2008,98 min,Action,"Tony Jaa, Panna Rittikrai","Tony Jaa (story), Panna Rittikrai (story), Ek Iemchuen (screenplay), Nontakorn Taweesuk (screenplay)","Tony Jaa, Sarunyu Wongkrachang, Sorapong Chatree, Primorata Dejudom",A young Thai boxer learns the skills and inner meaning of martial arts.,Thai,Thailand,1 win & 7 nominations.,"[{'Source': 'Internet Movie Database', 'Value': '6.2/10'}, {'Source': 'Rotten Tomatoes', 'Value': '48%'}, {'Source': 'Metacritic', 'Value': '47/100'}]",47,6.2,"27,934",tt0785035,movie,02 Feb 2010,N/A,Magnolia Pictures,N/A,True
Killshot,2008,R,13 Nov 2008,95 min,"Action, Crime, Drama, Thriller",John Madden,"Hossein Amini (screenplay), Elmore Leonard (novel)","Mickey Rourke, Brandon McGibbon, Peter Kelly Gaudreault, Michelle Arvizu","Beautiful Carmen Colson and her ironworker husband Wayne are placed in the Federal Witness Protection program after witnessing an ""incident"". Thinking they are at last safe, they are targeted by an experienced hit man and a psychopathic young upstart killer. The ensuing struggle will test Carmen to the limit.",English,USA,N/A,"[{'Source': 'Internet Movie Database', 'Value': '6.0/10'}, {'Source': 'Rotten Tomatoes', 'Value': '43%'}]",N/A,6.0,"19,986",tt0443559,movie,26 May 2009,N/A,The Weinstein Co.,N/A,True
Flashbacks of a Fool,2008,R,17 Oct 2008,109 min,Drama,Baillie Walsh,Baillie Walsh,"Emile Robert, Scoutt Lowe, Daniel Craig, Julie Ordon",A fading Hollywood star looks back at the days of his youth as he returns home from his best friend's funeral.,English,UK,N/A,"[{'Source': 'Internet Movie Database', 'Value': '6.8/10'}, {'Source': 'Rotten Tomatoes', 'Value': '38%'}]",N/A,6.8,"11,513",tt1037218,movie,22 Sep 2008,N/A,Anchor Bay Entertainment,N/A,True
Passchendaele,2008,R,17 Oct 2008,114 min,"Drama, History, Romance, War",Paul Gross,Paul Gross,"Paul Gross, Michael Greyeyes, James Kot, Jesse Frechette","The lives of a troubled veteran, his nurse girlfriend and a naive boy intersect first in Alberta and then in Belgium during the bloody World War I battle of Passchendaele.","English, German",Canada,11 wins & 5 nominations.,"[{'Source': 'Internet Movie Database', 'Value': '6.4/10'}, {'Source': 'Rotten Tomatoes', 'Value': '40%'}]",N/A,6.4,"7,706",tt1092082,movie,03 Nov 2009,N/A,Alliance Atlantis,N/A,True
Strange Wilderness,2008,R,01 Feb 2008,87 min,"Adventure, Comedy",Fred Wolf,"Peter Gaulke, Fred Wolf","Steve Zahn, Allen Covert, Jonah Hill, Kevin Heffernan","With the ratings dropping for a wilderness-themed television show, two animal fans go to the Andes Mountains in search of Bigfoot.",English,USA,N/A,"[{'Source': 'Internet Movie Database', 'Value': '5.3/10'}, {'Source': 'Rotten Tomatoes', 'Value': '2%'}, {'Source': 'Metacritic', 'Value': '12/100'}]",12,5.3,"20,267",tt0489282,movie,20 May 2008,"$6,515,869",Paramount Classics,N/A,True
The Children,2008,R,05 Dec 2008,84 min,"Horror, Mystery, Thriller",Tom Shankland,"Paul Andrew Williams (story), Tom Shankland","Eva Birthistle, Stephen Campbell Moore, Jeremy Sheffield, Rachel Shelley",A relaxing Christmas vacation turns into a terrifying fight for survival as the children begin to turn on their parents.,English,UK,1 win & 6 nominations.,"[{'Source': 'Internet Movie Database', 'Value': '6.0/10'}]",N/A,6.0,"16,359",tt1172571,movie,N/A,N/A,N/A,N/A,True
,,,,,,,,,,,,,,,,,,,,,,,False
Swing Vote,2008,PG-13,01 Aug 2008,120 min,"Comedy, Drama",Joshua Michael Stern,"Jason Richman, Joshua Michael Stern, David Giammarco (additional dialogue)","Kevin Costner, Madeline Carroll, Paula Patton, Kelsey Grammer","In a remarkable turn-of-events, the result of the presidential election comes down to one man's vote.",English,USA,1 nomination.,"[{'Source': 'Internet Movie Database', 'Value': '6.1/10'}, {'Source': 'Rotten Tomatoes', 'Value': '38%'}, {'Source': 'Metacritic', 'Value': '47/100'}]",47,6.1,"17,018",tt1027862,movie,13 Jan 2009,"$16,229,781",Touchstone Pictures/Treehouse Films,N/A,True
JCVD,2008,R,02 Aug 2019,97 min,"Comedy, Crime, Drama",Mabrouk El Mechri,"Mabrouk El Mechri (scenario), Frédéric Benudis (in collaboration with), Mabrouk El Mechri (adaptation), Frédéric Taddeï (original idea), Vincent Ravalec (original idea), Christophe Turpin","Jean-Claude Van Damme, Valérie Bodson, Hervé Sogne, Rock Chen",Jean-Claude Van Damme gets involved in a bank robbery with hostages situation and reflects about his life during it.,"French, English","Belgium, Luxembourg, France",2 nominations.,"[{'Source': 'Internet Movie Database', 'Value': '7.1/10'}, {'Source': 'Rotten Tomatoes', 'Value': '84%'}, {'Source': 'Metacritic', 'Value': '64/100'}]",64,7.1,"36,421",tt1130988,movie,28 Apr 2009,"$382,923",Peach Arch Entertainment/Vitagraph Films,N/A,True
The Accidental Husband,2008,PG-13,29 Feb 2008,90 min,"Comedy, Romance",Griffin Dunne,"Mimi Hare, Clare Naylor, Bonnie Sikowitz","Uma Thurman, Jeffrey Dean Morgan, Colin Firth, Sam Shepard","When talk radio host Emma Lloyd advises one of her listeners to break up with her boyfriend, the jilted ex sets about getting his revenge.","English, Hindi, German","USA, Ireland",N/A,"[{'Source': 'Internet Movie Database', 'Value': '5.6/10'}, {'Source': 'Rotten Tomatoes', 'Value': '6%'}, {'Source': 'Metacritic', 'Value': '14/100'}]",14,5.6,"22,287",tt0809504,movie,10 Nov 2009,N/A,Yari Film Group,N/A,True
The Stoning of Soraya M.,2008,R,09 Oct 2009,114 min,Drama,Cyrus Nowrasteh,"Betsy Giffen Nowrasteh (screenplay), Cyrus Nowrasteh (screenplay), Freidoune Sahebjam (book)","Shohreh Aghdashloo, Mozhan Marnò, Jim Caviezel, Navid Negahban",A desperate woman asks for a meeting with a journalist to disclose the cruel and inhumane punishment of her niece.,"Persian, English",USA,6 wins & 8 nominations.,"[{'Source': 'Internet Movie Database', 'Value': '8.0/10'}, {'Source': 'Rotten Tomatoes', 'Value': '59%'}, {'Source': 'Metacritic', 'Value': '50/100'}]",50,8.0,"17,511",tt1277737,movie,09 Mar 2010,"$519,730",Roadside Attractions,N/A,True
,,,,,,,,,,,,,,,,,,,,,,,False
Rab Ne Bana Di Jodi,2008,Not Rated,12 Dec 2008,167 min,"Comedy, Drama, Music, Romance",Aditya Chopra,"Aditya Chopra (dialogue), Aditya Chopra (screenplay), Aditya Chopra (story)","Shah Rukh Khan, Anushka Sharma, Vinay Pathak, M.K. Raina","A breathtaking, goose flesh igniting, awe inspiring love journey of an ordinary man Suri and his 'total opposite' love Taani.",Hindi,India,3 wins & 11 nominations.,"[{'Source': 'Internet Movie Database', 'Value': '7.1/10'}, {'Source': 'Rotten Tomatoes', 'Value': '78%'}]",N/A,7.1,"40,902",tt1182937,movie,12 May 2009,"$2,040,699",Yash Raj Films,N/A,True
The Yellow Handkerchief,2008,PG-13,19 Nov 2009,102 min,"Drama, Romance",Udayan Prasad,"Pete Hamill (story), Erin Dignam (screenplay)","William Hurt, Maria Bello, Kristen Stewart, Eddie Redmayne",A road trip through Louisiana transforms three strangers who were originally brought together by their respective feelings of loneliness.,English,USA,N/A,"[{'Source': 'Internet Movie Database', 'Value': '6.8/10'}, {'Source': 'Rotten Tomatoes', 'Value': '66%'}, {'Source': 'Metacritic', 'Value': '62/100'}]",62,6.8,"7,642",tt0954990,movie,01 Jul 2010,"$229,550",Samuel Goldwyn Films,N/A,True
What Doesn't Kill You,2008,R,10 Sep 2009,100 min,"Crime, Drama",Brian Goodman,"Brian Goodman, Paul T. Murray, Donnie Wahlberg","Mark Ruffalo, Ethan Hawke, Amanda Peet, Will Lyman","Two childhood friends from South Boston turn to crime as a way to get by, ultimately causing a strain in their personal lives and their friendship.",English,USA,1 nomination.,"[{'Source': 'Internet Movie Database', 'Value': '6.6/10'}, {'Source': 'Rotten Tomatoes', 'Value': '65%'}, {'Source': 'Metacritic', 'Value': '71/100'}]",71,6.6,"11,233",tt1133991,movie,28 Apr 2009,N/A,Yari Film Group,N/A,True
Max Manus: Man of War,2008,Not Rated,03 Sep 2010,118 min,"Action, Biography, Drama, History, War","Joachim Rønning, Espen Sandberg",Thomas Nordseth-Tiller,"Aksel Hennie, Agnes Kittelsen, Nicolai Cleve Broch, Ken Duken",The true story about one of the most brilliant saboteurs during World War II and his battle to overcome his inner demons.,"Norwegian, German, English, Russian, Finnish","Norway, Denmark, Germany",12 wins & 4 nominations.,"[{'Source': 'Internet Movie Database', 'Value': '7.3/10'}, {'Source': 'Rotten Tomatoes', 'Value': '79%'}, {'Source': 'Metacritic', 'Value': '60/100'}]",60,7.3,"25,103",tt1029235,movie,28 Jun 2011,N/A,Nordisk Film Biograf Distribution,N/A,True
,,,,,,,,,,,,,,,,,,,,,,,False
The Wackness,2008,R,01 Aug 2008,99 min,"Comedy, Drama, Romance",Jonathan Levine,Jonathan Levine,"Ben Kingsley, Josh Peck, Famke Janssen, Olivia Thirlby","It's the summer of 1994, and the streets of New York are pulsing with hip-hop. Set against this backdrop, a lonely teenager named Luke Shapiro spends his last summer before university selling marijuana throughout New York City, trading it with his unorthodox psychotherapist for treatment, while having a crush on his stepdaughter.",English,"UK, USA",4 wins & 4 nominations.,"[{'Source': 'Internet Movie Database', 'Value': '7.0/10'}, {'Source': 'Rotten Tomatoes', 'Value': '70%'}, {'Source': 'Metacritic', 'Value': '61/100'}]",61,7.0,"29,217",tt1082886,movie,06 Jan 2009,"$2,100,000",Sony Pictures Classics,N/A,True
Little Ashes,2008,R,08 May 2009,112 min,"Biography, Drama, Romance",Paul Morrison,Philippa Goslett,"Javier Beltrán, Robert Pattinson, Matthew McNulty, Marina Gatell","About the young life and loves of artist Salvador Dalí, filmmaker Luis Buñuel and writer Federico García Lorca.","English, Spanish","UK, Spain",1 win.,"[{'Source': 'Internet Movie Database', 'Value': '6.5/10'}, {'Source': 'Rotten Tomatoes', 'Value': '24%'}, {'Source': 'Metacritic', 'Value': '41/100'}]",41,6.5,"8,314",tt1104083,movie,26 Jan 2010,"$400,000",Regent Releasing,N/A,True
Make It Happen,2008,PG-13,08 Aug 2008,90 min,Drama,Darren Grant,"Duane Adler (screenplay), Nicole Avril (screenplay), Duane Adler (story)","Mary Elizabeth Winstead, Tessa Thompson, Riley Smith, John Reardon","Embarking on a journey to fulfill her dreams as a dancer, a young girl discovers a new style of dance that will prove to be the source of both conflict and self-discovery.",English,USA,N/A,"[{'Source': 'Internet Movie Database', 'Value': '5.4/10'}, {'Source': 'Rotten Tomatoes', 'Value': '22%'}]",N/A,5.4,"5,816",tt0822868,movie,09 Dec 2008,N/A,The Weinstein Co./MGM,N/A,True
Management,2008,R,15 May 2009,94 min,"Comedy, Drama, Romance",Stephen Belber,Stephen Belber,"Jennifer Aniston, Steve Zahn, Margo Martindale, Fred Ward",A traveling art saleswoman tries to shake off a flaky motel manager who falls for her and won't leave her alone.,"English, Mandarin",USA,N/A,"[{'Source': 'Internet Movie Database', 'Value': '5.8/10'}, {'Source': 'Rotten Tomatoes', 'Value': '47%'}, {'Source': 'Metacritic', 'Value': '50/100'}]",50,5.8,"16,558",tt1082853,movie,29 Sep 2009,"$809,787",IDP/Samuel goldwyn Films,N/A,True
The Square,2008,R,31 Jul 2008,105 min,"Crime, Drama, Thriller",Nash Edgerton,"Joel Edgerton, Matthew Dabner, Joel Edgerton (original story)","David Roberts, Claire van der Boom, Peter Phelps, Bill Hunter",A man's life begins to unravel when his mistress brings him a bag of cash.,English,Australia,2 wins & 15 nominations.,"[{'Source': 'Internet Movie Database', 'Value': '6.7/10'}, {'Source': 'Rotten Tomatoes', 'Value': '86%'}, {'Source': 'Metacritic', 'Value': '75/100'}]",75,6.7,"5,236",tt1085507,movie,24 Aug 2010,"$404,898",Apparition,N/A,True
Kit Kittredge: An American Girl,2008,G,02 Jul 2008,101 min,"Comedy, Drama, Family",Patricia Rozema,"Ann Peacock, Valerie Tripp (Kit Kittredge stories)","Abigail Breslin, Julia Ormond, Chris O'Donnell, Jane Krakowski","Set in Cincinnati at the height of the Great Depression, Kit Kittredge, a resourceful young girl, helps her mother run a boardinghouse after her father loses his job.",English,"USA, Canada",2 wins & 5 nominations.,"[{'Source': 'Internet Movie Database', 'Value': '6.5/10'}, {'Source': 'Rotten Tomatoes', 'Value': '80%'}, {'Source': 'Metacritic', 'Value': '63/100'}]",63,6.5,"5,350",tt0846308,movie,28 Oct 2008,"$17,533,514",Picturehouse,N/A,True
Jodhaa Akbar,2008,Not Rated,15 Feb 2008,213 min,"Action, Drama, History, Romance, War",Ashutosh Gowariker,"Haidar Ali (story), Haidar Ali (screenplay), Ashutosh Gowariker (screenplay), K.P. Saxena (dialogue), Rajshri Sudhakar (Dialogue Writer: Telugu)","Hrithik Roshan, Aishwarya Rai Bachchan, Sonu Sood, Poonam Sinha","A sixteenth century love story about a marriage of alliance that gave birth to true love between a great Mughal emperor, Akbar, and a Rajput princess, Jodha.","Hindi, Urdu",India,22 wins & 25 nominations.,"[{'Source': 'Internet Movie Database', 'Value': '7.6/10'}, {'Source': 'Rotten Tomatoes', 'Value': '75%'}, {'Source': 'Metacritic', 'Value': '69/100'}]",69,7.6,"27,508",tt0449994,movie,09 Sep 2008,N/A,UTV Communications,N/A,True
,,,,,,,,,,,,,,,,,,,,,,,False
Ong Bak 2,2008,R,04 Dec 2008,98 min,Action,"Tony Jaa, Panna Rittikrai","Tony Jaa (story), Panna Rittikrai (story), Ek Iemchuen (screenplay), Nontakorn Taweesuk (screenplay)","Tony Jaa, Sarunyu Wongkrachang, Sorapong Chatree, Primorata Dejudom",A young Thai boxer learns the skills and inner meaning of martial arts.,Thai,Thailand,1 win & 7 nominations.,"[{'Source': 'Internet Movie Database', 'Value': '6.2/10'}, {'Source': 'Rotten Tomatoes', 'Value': '48%'}, {'Source': 'Metacritic', 'Value': '47/100'}]",47,6.2,"27,934",tt0785035,movie,02 Feb 2010,N/A,Magnolia Pictures,N/A,True
Killshot,2008,R,13 Nov 2008,95 min,"Action, Crime, Drama, Thriller",John Madden,"Hossein Amini (screenplay), Elmore Leonard (novel)","Mickey Rourke, Brandon McGibbon, Peter Kelly Gaudreault, Michelle Arvizu","Beautiful Carmen Colson and her ironworker husband Wayne are placed in the Federal Witness Protection program after witnessing an ""incident"". Thinking they are at last safe, they are targeted by an experienced hit man and a psychopathic young upstart killer. The ensuing struggle will test Carmen to the limit.",English,USA,N/A,"[{'Source': 'Internet Movie Database', 'Value': '6.0/10'}, {'Source': 'Rotten Tomatoes', 'Value': '43%'}]",N/A,6.0,"19,986",tt0443559,movie,26 May 2009,N/A,The Weinstein Co.,N/A,True
Flashbacks of a Fool,2008,R,17 Oct 2008,109 min,Drama,Baillie Walsh,Baillie Walsh,"Emile Robert, Scoutt Lowe, Daniel Craig, Julie Ordon",A fading Hollywood star looks back at the days of his youth as he returns home from his best friend's funeral.,English,UK,N/A,"[{'Source': 'Internet Movie Database', 'Value': '6.8/10'}, {'Source': 'Rotten Tomatoes', 'Value': '38%'}]",N/A,6.8,"11,513",tt1037218,movie,22 Sep 2008,N/A,Anchor Bay Entertainment,N/A,True
Passchendaele,2008,R,17 Oct 2008,114 min,"Drama, History, Romance, War",Paul Gross,Paul Gross,"Paul Gross, Michael Greyeyes, James Kot, Jesse Frechette","The lives of a troubled veteran, his nurse girlfriend and a naive boy intersect first in Alberta and then in Belgium during the bloody World War I battle of Passchendaele.","English, German",Canada,11 wins & 5 nominations.,"[{'Source': 'Internet Movie Database', 'Value': '6.4/10'}, {'Source': 'Rotten Tomatoes', 'Value': '40%'}]",N/A,6.4,"7,706",tt1092082,movie,03 Nov 2009,N/A,Alliance Atlantis,N/A,True
Strange Wilderness,2008,R,01 Feb 2008,87 min,"Adventure, Comedy",Fred Wolf,"Peter Gaulke, Fred Wolf","Steve Zahn, Allen Covert, Jonah Hill, Kevin Heffernan","With the ratings dropping for a wilderness-themed television show, two animal fans go to the Andes Mountains in search of Bigfoot.",English,USA,N/A,"[{'Source': 'Internet Movie Database', 'Value': '5.3/10'}, {'Source': 'Rotten Tomatoes', 'Value': '2%'}, {'Source': 'Metacritic', 'Value': '12/100'}]",12,5.3,"20,267",tt0489282,movie,20 May 2008,"$6,515,869",Paramount Classics,N/A,True
The Children,2008,R,05 Dec 2008,84 min,"Horror, Mystery, Thriller",Tom Shankland,"Paul Andrew Williams (story), Tom Shankland","Eva Birthistle, Stephen Campbell Moore, Jeremy Sheffield, Rachel Shelley",A relaxing Christmas vacation turns into a terrifying fight for survival as the children begin to turn on their parents.,English,UK,1 win & 6 nominations.,"[{'Source': 'Internet Movie Database', 'Value': '6.0/10'}]",N/A,6.0,"16,359",tt1172571,movie,N/A,N/A,N/A,N/A,True
Garden Party,2008,Not Rated,30 May 2008,88 min,Drama,Jason Freeland,Jason Freeland,"Tierra Abbott, Christopher Allport, Lisa Arturo, Erik Bragg","April (age 15) is running from one bad situation into another, hoping to find an answer that doesn't involve nudity, and falls in with a group of confused kids chasing their dreams. The black widow in the web is the sexy, pot-dealing Sally.",English,USA,N/A,"[{'Source': 'Internet Movie Database', 'Value': '5.5/10'}, {'Source': 'Rotten Tomatoes', 'Value': '15%'}, {'Source': 'Metacritic', 'Value': '31/100'}]",31,5.5,"3,242",tt0828393,movie,18 Nov 2008,N/A,Lionsgate,N/A,True
Meet the Browns,2008,PG-13,21 Mar 2008,100 min,"Comedy, Drama, Romance",Tyler Perry,Tyler Perry (play),"Tyler Perry, David Mann, Tamela J. Mann, Angela Bassett","A single mom takes her family to Georgia for the funeral of her father -- a man she never met. There, her clan is introduced to the crass, fun-loving Brown family.",English,USA,3 nominations.,"[{'Source': 'Internet Movie Database', 'Value': '4.3/10'}, {'Source': 'Rotten Tomatoes', 'Value': '33%'}, {'Source': 'Metacritic', 'Value': '45/100'}]",45,4.3,"6,297",tt1047494,movie,01 Jul 2008,"$41,939,392",Lionsgate Films,N/A,True
,,,,,,,,,,,,,,,,,,,,,,,False
An American Affair,2008,R,27 Feb 2009,93 min,Drama,William Olsson,Alex Metcalf,"Gretchen Mol, James Rebhorn, Cameron Bright, Mark Pellegrino","In 1963, during the swirl of glamour and intrigue that turned President John F. Kennedy's Washington into Camelot, a lonely 13-year-old Catholic school boy comes of age.",English,USA,1 nomination.,"[{'Source': 'Internet Movie Database', 'Value': '6.2/10'}, {'Source': 'Rotten Tomatoes', 'Value': '16%'}, {'Source': 'Metacritic', 'Value': '31/100'}]",31,6.2,"1,930",tt0899138,movie,28 Jul 2009,N/A,Screen Media Films,N/A,True
Restraint,2008,R,19 Aug 2008,94 min,"Drama, Thriller",David Denneen,Dave Warner,"Travis Fimmel, Teresa Palmer, Stephen Moyer, Phillip Holder",A young couple on the run hole up in a country estate with a hostage in tow.,English,Australia,N/A,"[{'Source': 'Internet Movie Database', 'Value': '6.1/10'}]",N/A,6.1,"5,600",tt0441782,movie,19 Aug 2008,N/A,Filmgraphics Entertainment,N/A,True
Flash of Genius,2008,PG-13,03 Oct 2008,119 min,"Biography, Drama",Marc Abraham,"Philip Railsback, John Seabrook (article)","Greg Kinnear, Tim Eddis, Warren Belle, Karl Pruner",Robert Kearns takes on the Detroit automakers who he claims stole his idea for the intermittent windshield wiper.,"English, Spanish","Canada, USA",1 win.,"[{'Source': 'Internet Movie Database', 'Value': '7.0/10'}, {'Source': 'Rotten Tomatoes', 'Value': '60%'}, {'Source': 'Metacritic', 'Value': '57/100'}]",57,7.0,"15,932",tt1054588,movie,17 Feb 2009,"$4,234,040",Universal Pictures,N/A,True
Donkey Punch,2008,R,18 Jul 2008,99 min,"Crime, Drama, Horror, Thriller",Olly Blackburn,"Olly Blackburn (screenplay), David Bloom (screenplay)","Robert Boulter, Sian Breckin, Tom Burke, Nichola Burley",Things go drastically wrong for a group of British holidaymakers in Spain.,English,UK,N/A,"[{'Source': 'Internet Movie Database', 'Value': '5.1/10'}, {'Source': 'Rotten Tomatoes', 'Value': '52%'}, {'Source': 'Metacritic', 'Value': '43/100'}]",43,5.1,"10,280",tt0988849,movie,07 Apr 2009,N/A,Magnolia Pictures,N/A,True
Far Cry,2008,R,02 Oct 2008,95 min,"Action, Adventure, Sci-Fi",Uwe Boll,"Michael Roesch, Peter Scheerer, Masaji Takei","Til Schweiger, Emmanuelle Vaugier, Natalia Avelon, Udo Kier",An ex-special forces soldier turned boatman is hired by a journalist to investigate a top-secret military base on a nearby island.,English,"Germany, Canada",N/A,"[{'Source': 'Internet Movie Database', 'Value': '3.1/10'}]",N/A,3.1,"12,756",tt0400426,movie,14 Apr 2009,N/A,Vivendi Entertainment,N/A,True
