Title,Year,Rated,Released,Runtime,Genre,Director,Writer,Actors,Plot,Language,Country,Awards,Ratings,Metascore,imdbRating,imdbVotes,imdbID,Type,DVD,BoxOffice,Production,Website,Response
Felon,2008,R,17 Jul 2008,104 min,"Crime, Drama",Ric Roman Waugh,Ric Roman Waugh,"Stephen Dorff, Marisol Nichols, Vincent Miller, Anne Archer",A family man convicted of killing an intruder must cope with life afterward in the violent penal system.,English,USA,N/A,"[{'Source': 'Internet Movie Database', 'Value': '7.4/10'}, {'Source': 'Rotten Tomatoes', 'Value': '61%'}, {'Source': 'Metacritic', 'Value': '58/100'}]",58,7.4,"72,833",tt1117385,movie,18 Jul 2008,N/A,Sony Pictures Entertainment,N/A,True
Untraceable,2008,R,25 Jan 2008,101 min,"Crime, Mystery, Thriller",Gregory Hoblit,"Robert Fyvolent (screenplay), Mark Brinker (screenplay), Allison Burnett (screenplay), Robert Fyvolent (story), Mark Brinker (story)","Diane Lane, Billy Burke, Colin Hanks, Joseph Cross","FBI agent Jennifer Marsh is tasked with hunting down a seemingly untraceable serial killer who posts live videos of his victims on the Internet. As time runs out, the cat and mouse chase becomes more personal.",English,USA,1 win.,"[{'Source': 'Internet Movie Database', 'Value': '6.2/10'}, {'Source': 'Rotten Tomatoes', 'Value': '16%'}, {'Source': 'Metacritic', 'Value': '32/100'}]",32,6.2,"45,558",tt0880578,movie,13 May 2008,"$28,687,835",Sony/Screen Gems,N/A,True
Choke,2008,R,26 Sep 2008,92 min,"Comedy, Drama",Clark Gregg,"Clark Gregg (screenplay), Chuck Palahniuk (novel)","Kathryn Alexander, Teodorina Bello, Kate Blumberg, Jonah Bobo",A sex-addicted con-man pays for his mother's hospital bills by playing on the sympathies of those who rescue him from choking to death.,English,USA,2 wins & 6 nominations.,"[{'Source': 'Internet Movie Database', 'Value': '6.5/10'}, {'Source': 'Rotten Tomatoes', 'Value': '55%'}, {'Source': 'Metacritic', 'Value': '47/100'}]",47,6.5,"30,640",tt1024715,movie,17 Feb 2009,"$2,831,900",Fox Searchlight,N/A,True
Good Dick,2008,R,03 Oct 2008,86 min,"Comedy, Drama, Romance",Marianna Palka,Marianna Palka,"Marianna Palka, Jason Ritter, Eric Edelstein, Mark Webber",A look at the relationship between a lonely introverted girl and a young video store clerk vying for her attention.,"English, Polish, German",USA,1 win & 1 nomination.,"[{'Source': 'Internet Movie Database', 'Value': '6.4/10'}, {'Source': 'Rotten Tomatoes', 'Value': '50%'}, {'Source': 'Metacritic', 'Value': '54/100'}]",54,6.4,"7,482",tt0944101,movie,01 Sep 2009,N/A,42 West,N/A,True
Beverly Hills Chihuahua,2008,PG,03 Oct 2008,91 min,"Adventure, Comedy, Drama, Family, Romance",Raja Gosnell,"Analisa LaBianco (screenplay), Jeffrey Bushell (screenplay), Jeffrey Bushell (story)","Piper Perabo, Manolo Cardona, Jamie Lee Curtis, José María Yazpik","While on vacation in Mexico, Chloe, a ritzy Beverly Hills chihuahua, finds herself lost and in need of assistance in order to get back home.",English,"USA, Mexico",2 wins & 7 nominations.,"[{'Source': 'Internet Movie Database', 'Value': '3.8/10'}, {'Source': 'Rotten Tomatoes', 'Value': '40%'}, {'Source': 'Metacritic', 'Value': '41/100'}]",41,3.8,"21,314",tt1014775,movie,03 Mar 2009,"$94,497,271",Walt Disney Pictures,N/A,True
Extreme Movie,2008,R,29 Jul 2009,86 min,Comedy,"Adam Jay Epstein, Andrew Jacobson","Adam Jay Epstein, Andrew Jacobson, Will Forte, John Solomon, Andy Samberg, Akiva Schaffer, Jorma Taccone, Erica Rivinoja, Phil Lord, Christopher Miller","Patrick J. Adams, Denise Boutte, Brian Burt, Michael Cera",A sketch comedy movie about the joys and embarrassments of teen sex. But mostly the embarrassments.,English,USA,N/A,"[{'Source': 'Internet Movie Database', 'Value': '3.7/10'}]",N/A,3.7,"10,443",tt0806147,movie,24 Feb 2009,N/A,Dimension Films/The Weinstein Company,N/A,True
Traitor,2008,PG-13,27 Aug 2008,114 min,"Action, Crime, Drama, Thriller",Jeffrey Nachmanoff,"Jeffrey Nachmanoff (screenplay), Steve Martin (story), Jeffrey Nachmanoff (story)","Don Cheadle, Guy Pearce, Saïd Taghmaoui, Neal McDonough","When straight arrow FBI agent Roy Clayton heads up the investigation into a dangerous international conspiracy, all clues seem to lead back to former U.S. Special Operations officer, Samir Horn.","English, Arabic",USA,5 nominations.,"[{'Source': 'Internet Movie Database', 'Value': '7.0/10'}, {'Source': 'Rotten Tomatoes', 'Value': '65%'}, {'Source': 'Metacritic', 'Value': '60/100'}]",60,7.0,"53,561",tt0988047,movie,17 Feb 2009,"$23,501,463",Overture Films,N/A,True
The Informers,2008,R,24 Apr 2009,98 min,"Crime, Drama, Thriller",Gregor Jordan,"Bret Easton Ellis (screenplay), Nicholas Jarecki (screenplay), Bret Easton Ellis (novel)","Jon Foster, Billy Bob Thornton, Austin Nichols, Amber Heard","One week in L.A. in 1983, featuring movie executives, rock stars, a vampire and other morally challenged characters in adventures laced with sex, drugs and violence.",English,"Germany, USA",N/A,"[{'Source': 'Internet Movie Database', 'Value': '5.0/10'}, {'Source': 'Rotten Tomatoes', 'Value': '12%'}, {'Source': 'Metacritic', 'Value': '20/100'}]",20,5.0,"15,459",tt0865554,movie,25 Aug 2009,N/A,Senator International,N/A,True
Splinter,2008,R,03 Apr 2009,82 min,"Horror, Sci-Fi, Thriller",Toby Wilkins,"Ian Shorr, Kai Barry","Charles Baker, Jill Wagner, Paulo Costanzo, Shea Whigham","Trapped in an isolated gas station by a voracious Splinter parasite that transforms its still-living victims into deadly hosts, a young couple and an escaped convict must find a way to work together to survive this primal terror.",English,USA,7 wins & 1 nomination.,"[{'Source': 'Internet Movie Database', 'Value': '6.1/10'}, {'Source': 'Rotten Tomatoes', 'Value': '74%'}, {'Source': 'Metacritic', 'Value': '58/100'}]",58,6.1,"31,399",tt1031280,movie,27 Jan 2009,N/A,Magnolia Pictures/Magnet Pictures,N/A,True
Zombie Strippers!,2008,R,19 Sep 2008,94 min,"Comedy, Horror, Sci-Fi",Jay Lee,Jay Lee,"Jenna Jameson, Robert Englund, Roxy Saint, Penny Vital",A zombie epidemic spreads throughout a strip club in Nebraska.,English,USA,1 nomination.,"[{'Source': 'Internet Movie Database', 'Value': '4.1/10'}, {'Source': 'Rotten Tomatoes', 'Value': '39%'}, {'Source': 'Metacritic', 'Value': '45/100'}]",45,4.1,"17,094",tt0960890,movie,28 Oct 2008,N/A,Triumph Films,N/A,True
,,,,,,,,,,,,,,,,,,,,,,,False
,,,,,,,,,,,,,,,,,,,,,,,False
Jolene,2008,R,13 Jun 2008,121 min,Drama,Dan Ireland,"Dennis Yares (screenplay by), E.L. Doctorow (story ""Jolene: A Life""), Michael Gilio (additional writing by)","Jessica Chastain, Frances Fisher, Rupert Friend, Dermot Mulroney","A teenage orphan spends ten years traveling cross-country experiencing life, love and heartbreak. Based on E.L. Doctorow's story, ""Jolene: A Life.""",English,USA,2 wins.,"[{'Source': 'Internet Movie Database', 'Value': '6.4/10'}, {'Source': 'Rotten Tomatoes', 'Value': '48%'}, {'Source': 'Metacritic', 'Value': '31/100'}]",31,6.4,"4,006",tt0867334,movie,26 Apr 2011,N/A,E1 Entertainment,N/A,True
Baby Mama,2008,PG-13,25 Apr 2008,99 min,"Comedy, Romance",Michael McCullers,Michael McCullers,"Amy Poehler, Tina Fey, Greg Kinnear, Dax Shepard","A successful, single businesswoman who dreams of having a baby discovers she is infertile and hires a working class woman to be her unlikely surrogate.",English,USA,1 win & 5 nominations.,"[{'Source': 'Internet Movie Database', 'Value': '6.0/10'}, {'Source': 'Rotten Tomatoes', 'Value': '64%'}, {'Source': 'Metacritic', 'Value': '55/100'}]",55,6.0,"39,854",tt0871426,movie,09 Sep 2008,"$60,269,340",Universal Pictures,N/A,True
Strictly Sexual,2008,R,24 Feb 2009,100 min,"Comedy, Drama, Romance",Joel Viertel,Stevie Long,"Amber Benson, Johann Urb, Kristen Kerr, Stevie Long","Two successful women, sick and tired of dating and relationships, decide to keep two young men in their pool house for strictly sexual purposes.",English,USA,N/A,"[{'Source': 'Internet Movie Database', 'Value': '6.3/10'}]",N/A,6.3,"4,902",tt0494277,movie,24 Feb 2009,N/A,Virgil Films,N/A,True
The Eye,2008,PG-13,01 Feb 2008,98 min,"Drama, Horror, Mystery, Thriller","David Moreau, Xavier Palud","Sebastian Gutierrez (screenplay), Yuet-Jan Hui, Oxide Chun Pang, Danny Pang","Jessica Alba, Alessandro Nivola, Parker Posey, Rade Serbedzija",A woman receives an eye transplant that allows her to see into the supernatural world.,"English, Spanish","USA, Canada",2 wins & 3 nominations.,"[{'Source': 'Internet Movie Database', 'Value': '5.4/10'}, {'Source': 'Rotten Tomatoes', 'Value': '22%'}, {'Source': 'Metacritic', 'Value': '36/100'}]",36,5.4,"49,449",tt0406759,movie,06 Jun 2008,"$31,400,000",Lionsgate Films,N/A,True
Miss Pettigrew Lives for a Day,2008,PG-13,07 Mar 2008,92 min,"Comedy, Romance",Bharat Nalluri,"David Magee (screenplay), Simon Beaufoy (screenplay), Winifred Watson (novel)","Amy Adams, David Alexander, Clare Clifford, Christina Cole","Guinevere Pettigrew, a middle-aged London governess, finds herself unfairly dismissed from her job. An attempt to gain new employment catapults her into the glamorous world and dizzying social whirl of an American actress and singer, Delysia Lafosse.",English,"UK, USA",1 nomination.,"[{'Source': 'Internet Movie Database', 'Value': '7.1/10'}, {'Source': 'Rotten Tomatoes', 'Value': '78%'}, {'Source': 'Metacritic', 'Value': '63/100'}]",63,7.1,"25,220",tt0970468,movie,19 Aug 2008,"$12,294,036",Focus Features,N/A,True
The Lucky Ones,2008,R,26 Sep 2008,115 min,"Comedy, Drama, War",Neil Burger,"Neil Burger, Dirk Wittenborn","Rachel McAdams, Tim Robbins, Michael Peña, Molly Hagan",Three different soldiers - a woman and two men - return from the war and facing the peaceful life's problems of each other.,English,USA,N/A,"[{'Source': 'Internet Movie Database', 'Value': '6.9/10'}, {'Source': 'Rotten Tomatoes', 'Value': '37%'}, {'Source': 'Metacritic', 'Value': '53/100'}]",53,6.9,"12,988",tt0981072,movie,27 Jan 2009,"$183,088",Lionsgate,N/A,True
Deadgirl,2008,R,20 Apr 2013,101 min,Horror,"Marcel Sarmiento, Gadi Harel(co-director)",Trent Haaga,"Shiloh Fernandez, Noah Segan, Candice King, Eric Podnar",Two high school boys discover an imprisoned woman in an abandoned mental asylum who cannot die.,English,USA,2 wins & 1 nomination.,"[{'Source': 'Internet Movie Database', 'Value': '5.6/10'}, {'Source': 'Rotten Tomatoes', 'Value': '29%'}, {'Source': 'Metacritic', 'Value': '36/100'}]",36,5.6,"17,818",tt0896534,movie,15 Sep 2009,N/A,Dark Sky Films,N/A,True
Semi-Pro,2008,R,29 Feb 2008,91 min,"Comedy, Sport",Kent Alterman,Scot Armstrong,"Will Ferrell, Woody Harrelson, André Benjamin, Maura Tierney","Jackie Moon, the owner-coach-player of the American Basketball Association's Flint Michigan Tropics, rallies his teammates to make their NBA dreams come true.",English,USA,1 win & 4 nominations.,"[{'Source': 'Internet Movie Database', 'Value': '5.8/10'}, {'Source': 'Rotten Tomatoes', 'Value': '22%'}, {'Source': 'Metacritic', 'Value': '47/100'}]",47,5.8,"75,170",tt0839980,movie,03 Jun 2008,"$33,370,443",New Line Cinema,N/A,True
,,,,,,,,,,,,,,,,,,,,,,,False
First Sunday,2008,PG-13,11 Jan 2008,96 min,"Comedy, Crime, Drama",David E. Talbert,David E. Talbert,"Ice Cube, Katt Williams, Tracy Morgan, Loretta Devine",Durell Washington and LeeJohn Jackson are best friends and bumbling petty criminals. When Durell learns that his ex-girlfriend plans to move to another state with their son Durell Jr.--...,English,USA,N/A,"[{'Source': 'Internet Movie Database', 'Value': '4.5/10'}, {'Source': 'Metacritic', 'Value': '41/100'}]",41,4.5,"9,063",tt0486578,movie,13 May 2008,N/A,N/A,N/A,True
Deception,2008,R,25 Apr 2008,107 min,"Crime, Drama, Mystery, Thriller",Marcel Langenegger,Mark Bomback,"Ewan McGregor, Hugh Jackman, Michelle Williams, Bruce Altman","An accountant is introduced to a mysterious sex club known as The List by his lawyer friend. But in this new world, he soon becomes the prime suspect in a woman's disappearance and a multi-million dollar heist.","English, Spanish, Cantonese",USA,N/A,"[{'Source': 'Internet Movie Database', 'Value': '6.1/10'}, {'Source': 'Rotten Tomatoes', 'Value': '11%'}, {'Source': 'Metacritic', 'Value': '31/100'}]",31,6.1,"36,536",tt0800240,movie,23 Sep 2008,"$4,575,019",20th Century Fox,N/A,True
Pride and Glory,2008,R,24 Oct 2008,130 min,"Crime, Drama, Thriller",Gavin O'Connor,"Joe Carnahan (screenplay), Gavin O'Connor (screenplay), Gavin O'Connor (story), Greg O'Connor (story), Robert Hopes (story)","Colin Farrell, Edward Norton, Jon Voight, Noah Emmerich","A family's moral codes are tested when Ray Tierney investigates a case that reveals an incendiary police corruption scandal involving his own brother-in-law. For Ray, the truth is revelatory, a Pandora's Box that threatens to upend not only the Tierney legacy but the entire NYPD.","English, Spanish","USA, Germany",2 nominations.,"[{'Source': 'Internet Movie Database', 'Value': '6.6/10'}, {'Source': 'Rotten Tomatoes', 'Value': '35%'}, {'Source': 'Metacritic', 'Value': '45/100'}]",45,6.6,"57,506",tt0482572,movie,27 Jan 2009,"$15,709,385",New Line Cinema,N/A,True
Che: Part One,2008,Not Rated,24 Jan 2009,134 min,"Biography, Drama, History, War",Steven Soderbergh,"Peter Buchman (screenplay), Ernesto 'Che' Guevara (memoir ""Reminiscences of the Cuban Revolutionary War"")","Julia Ormond, Benicio Del Toro, Oscar Isaac, Pablo Guevara","In 1956, Ernesto 'Che' Guevara and a band of Castro-led Cuban exiles mobilize an army to topple the regime of dictator Fulgencio Batista.","Spanish, English","France, Spain, Mexico",4 wins & 12 nominations.,"[{'Source': 'Internet Movie Database', 'Value': '7.2/10'}, {'Source': 'Rotten Tomatoes', 'Value': '67%'}]",N/A,7.2,"42,411",tt0892255,movie,14 Jul 2009,"$1,543,029",IFC Films,N/A,True
Felon,2008,R,17 Jul 2008,104 min,"Crime, Drama",Ric Roman Waugh,Ric Roman Waugh,"Stephen Dorff, Marisol Nichols, Vincent Miller, Anne Archer",A family man convicted of killing an intruder must cope with life afterward in the violent penal system.,English,USA,N/A,"[{'Source': 'Internet Movie Database', 'Value': '7.4/10'}, {'Source': 'Rotten Tomatoes', 'Value': '61%'}, {'Source': 'Metacritic', 'Value': '58/100'}]",58,7.4,"72,833",tt1117385,movie,18 Jul 2008,N/A,Sony Pictures Entertainment,N/A,True
Untraceable,2008,R,25 Jan 2008,101 min,"Crime, Mystery, Thriller",Gregory Hoblit,"Robert Fyvolent (screenplay), Mark Brinker (screenplay), Allison Burnett (screenplay), Robert Fyvolent (story), Mark Brinker (story)","Diane Lane, Billy Burke, Colin Hanks, Joseph Cross","FBI agent Jennifer Marsh is tasked with hunting down a seemingly untraceable serial killer who posts live videos of his victims on the Internet. As time runs out, the cat and mouse chase becomes more personal.",English,USA,1 win.,"[{'Source': 'Internet Movie Database', 'Value': '6.2/10'}, {'Source': 'Rotten Tomatoes', 'Value': '16%'}, {'Source': 'Metacritic', 'Value': '32/100'}]",32,6.2,"45,558",tt0880578,movie,13 May 2008,"$28,687,835",Sony/Screen Gems,N/A,True
Choke,2008,R,26 Sep 2008,92 min,"Comedy, Drama",Clark Gregg,"Clark Gregg (screenplay), Chuck Palahniuk (novel)","Kathryn Alexander, Teodorina Bello, Kate Blumberg, Jonah Bobo",A sex-addicted con-man pays for his mother's hospital bills by playing on the sympathies of those who rescue him from choking to death.,English,USA,2 wins & 6 nominations.,"[{'Source': 'Internet Movie Database', 'Value': '6.5/10'}, {'Source': 'Rotten Tomatoes', 'Value': '55%'}, {'Source': 'Metacritic', 'Value': '47/100'}]",47,6.5,"30,640",tt1024715,movie,17 Feb 2009,"$2,831,900",Fox Searchlight,N/A,True
Good Dick,2008,R,03 Oct 2008,86 min,"Comedy, Drama, Romance",Marianna Palka,Marianna Palka,"Marianna Palka, Jason Ritter, Eric Edelstein, Mark Webber",A look at the relationship between a lonely introverted girl and a young video store clerk vying for her attention.,"English, Polish, German",USA,1 win & 1 nomination.,"[{'Source': 'Internet Movie Database', 'Value': '6.4/10'}, {'Source': 'Rotten Tomatoes', 'Value': '50%'}, {'Source': 'Metacritic', 'Value': '54/100'}]",54,6.4,"7,482",tt0944101,movie,01 Sep 2009,N/A,42 West,N/A,True
Beverly Hills Chihuahua,2008,PG,03 Oct 2008,91 min,"Adventure, Comedy, Drama, Family, Romance",Raja Gosnell,"Analisa LaBianco (screenplay), Jeffrey Bushell (screenplay), Jeffrey Bushell (story)","Piper Perabo, Manolo Cardona, Jamie Lee Curtis, José María Yazpik","While on vacation in Mexico, Chloe, a ritzy Beverly Hills chihuahua, finds herself lost and in need of assistance in order to get back home.",English,"USA, Mexico",2 wins & 7 nominations.,"[{'Source': 'Internet Movie Database', 'Value': '3.8/10'}, {'Source': 'Rotten Tomatoes', 'Value': '40%'}, {'Source': 'Metacritic', 'Value': '41/100'}]",41,3.8,"21,314",tt1014775,movie,03 Mar 2009,"$94,497,271",Walt Disney Pictures,N/A,True
Extreme Movie,2008,R,29 Jul 2009,86 min,Comedy,"Adam Jay Epstein, Andrew Jacobson","Adam Jay Epstein, Andrew Jacobson, Will Forte, John Solomon, Andy Samberg, Akiva Schaffer, Jorma Taccone, Erica Rivinoja, Phil Lord, Christopher Miller","Patrick J. Adams, Denise Boutte, Brian Burt, Michael Cera",A sketch comedy movie about the joys and embarrassments of teen sex. But mostly the embarrassments.,English,USA,N/A,"[{'Source': 'Internet Movie Database', 'Value': '3.7/10'}]",N/A,3.7,"10,443",tt0806147,movie,24 Feb 2009,N/A,Dimension Films/The Weinstein Company,N/A,True
Traitor,2008,PG-13,27 Aug 2008,114 min,"Action, Crime, Drama, Thriller",Jeffrey Nachmanoff,"Jeffrey Nachmanoff (screenplay), Steve Martin (story), Jeffrey Nachmanoff (story)","Don Cheadle, Guy Pearce, Saïd Taghmaoui, Neal McDonough","When straight arrow FBI agent Roy Clayton heads up the investigation into a dangerous international conspiracy, all clues seem to lead back to former U.S. Special Operations officer, Samir Horn.","English, Arabic",USA,5 nominations.,"[{'Source': 'Internet Movie Database', 'Value': '7.0/10'}, {'Source': 'Rotten Tomatoes', 'Value': '65%'}, {'Source': 'Metacritic', 'Value': '60/100'}]",60,7.0,"53,561",tt0988047,movie,17 Feb 2009,"$23,501,463",Overture Films,N/A,True
The Informers,2008,R,24 Apr 2009,98 min,"Crime, Drama, Thriller",Gregor Jordan,"Bret Easton Ellis (screenplay), Nicholas Jarecki (screenplay), Bret Easton Ellis (novel)","Jon Foster, Billy Bob Thornton, Austin Nichols, Amber Heard","One week in L.A. in 1983, featuring movie executives, rock stars, a vampire and other morally challenged characters in adventures laced with sex, drugs and violence.",English,"Germany, USA",N/A,"[{'Source': 'Internet Movie Database', 'Value': '5.0/10'}, {'Source': 'Rotten Tomatoes', 'Value': '12%'}, {'Source': 'Metacritic', 'Value': '20/100'}]",20,5.0,"15,459",tt0865554,movie,25 Aug 2009,N/A,Senator International,N/A,True
Splinter,2008,R,03 Apr 2009,82 min,"Horror, Sci-Fi, Thriller",Toby Wilkins,"Ian Shorr, Kai Barry","Charles Baker, Jill Wagner, Paulo Costanzo, Shea Whigham","Trapped in an isolated gas station by a voracious Splinter parasite that transforms its still-living victims into deadly hosts, a young couple and an escaped convict must find a way to work together to survive this primal terror.",English,USA,7 wins & 1 nomination.,"[{'Source': 'Internet Movie Database', 'Value': '6.1/10'}, {'Source': 'Rotten Tomatoes', 'Value': '74%'}, {'Source': 'Metacritic', 'Value': '58/100'}]",58,6.1,"31,399",tt1031280,movie,27 Jan 2009,N/A,Magnolia Pictures/Magnet Pictures,N/A,True
Zombie Strippers!,2008,R,19 Sep 2008,94 min,"Comedy, Horror, Sci-Fi",Jay Lee,Jay Lee,"Jenna Jameson, Robert Englund, Roxy Saint, Penny Vital",A zombie epidemic spreads throughout a strip club in Nebraska.,English,USA,1 nomination.,"[{'Source': 'Internet Movie Database', 'Value': '4.1/10'}, {'Source': 'Rotten Tomatoes', 'Value': '39%'}, {'Source': 'Metacritic', 'Value': '45/100'}]",45,4.1,"17,094",tt0960890,movie,28 Oct 2008,N/A,Triumph Films,N/A,True
Fireproof,2008,PG,26 Sep 2008,122 min,"Drama, Fantasy, Romance",Alex Kendrick,"Alex Kendrick (story and screenplay), Stephen Kendrick (story and screenplay)","Kirk Cameron, Erin Bethea, Ken Bevel, Stephen Dervan","In an attempt to save his marriage, a firefighter uses a 40-day experiment known as ""The Love Dare.""",English,USA,N/A,"[{'Source': 'Internet Movie Database', 'Value': '6.5/10'}, {'Source': 'Rotten Tomatoes', 'Value': '40%'}, {'Source': 'Metacritic', 'Value': '28/100'}]",28,6.5,"19,950",tt1129423,movie,27 Jan 2009,"$33,451,479",Sherwood Pictures,N/A,True
Shutter,2008,PG-13,21 Mar 2008,85 min,"Horror, Mystery, Thriller",Masayuki Ochiai,Luke Dawson (screenplay),"Joshua Jackson, Rachael Taylor, Megumi Okina, David Denman","A newly married couple discovers disturbing, ghostly images in photographs they develop after a tragic accident. Fearing the manifestations may be connected, they investigate and learn that some mysteries are better left unsolved.","English, Japanese",USA,N/A,"[{'Source': 'Internet Movie Database', 'Value': '5.2/10'}, {'Source': 'Rotten Tomatoes', 'Value': '9%'}, {'Source': 'Metacritic', 'Value': '37/100'}]",37,5.2,"31,117",tt0482599,movie,15 Jul 2008,"$25,876,782",20th Century Fox,N/A,True
The Tale of Despereaux,2008,G,19 Dec 2008,93 min,"Animation, Adventure, Comedy, Family, Fantasy","Sam Fell, Robert Stevenhagen","Kate DiCamillo (book), Will McRobb (screen story), Gary Ross, Chris Viscardi (screen story)","Matthew Broderick, Dustin Hoffman, Emma Watson, Tracey Ullman",An unusually brave mouse helps to restore happiness to a forlorn kingdom after making friends with a gentleman rat.,English,"UK, USA",1 win & 8 nominations.,"[{'Source': 'Internet Movie Database', 'Value': '6.1/10'}, {'Source': 'Rotten Tomatoes', 'Value': '57%'}, {'Source': 'Metacritic', 'Value': '53/100'}]",53,6.1,"34,464",tt0420238,movie,07 Apr 2009,"$50,818,750",Universal Pictures,N/A,True
Nights in Rodanthe,2008,PG-13,26 Sep 2008,97 min,"Drama, Romance",George C. Wolfe,"Ann Peacock (screenplay), John Romano (screenplay), Nicholas Sparks (novel)","Richard Gere, Diane Lane, Christopher Meloni, Viola Davis","A doctor, who is travelling to see his estranged son, sparks with an unhappily married woman at a North Carolina inn.","English, Spanish","USA, Australia",1 nomination.,"[{'Source': 'Internet Movie Database', 'Value': '6.0/10'}, {'Source': 'Rotten Tomatoes', 'Value': '30%'}, {'Source': 'Metacritic', 'Value': '39/100'}]",39,6.0,"21,690",tt0956038,movie,10 Feb 2009,"$41,840,908",Warner Bros. Pictures/Village Roadshow,N/A,True
Loft,2008,N/A,22 Oct 2008,118 min,"Crime, Drama, Mystery, Romance, Thriller",Erik Van Looy,Bart De Pauw (screenplay),"Koen De Bouw, Filip Peeters, Matthias Schoenaerts, Bruno Vanden Broecke","Five close friends, all of them married, share a loft to meet their mistresses. One day they find the body of a young woman in the loft. Since there are only five keys to the loft, the five men begin to suspect each other of murder.","Flemish, Dutch",Belgium,N/A,"[{'Source': 'Internet Movie Database', 'Value': '7.3/10'}]",N/A,7.3,"19,893",tt0926762,movie,N/A,N/A,N/A,N/A,True
The Express,2008,PG,10 Oct 2008,130 min,"Biography, Drama, Sport",Gary Fleder,"Charles Leavitt, Robert Gallagher (book)","Rob Brown, Dennis Quaid, Darrin Dewitt Henson, Omar Benson Miller","A drama based on the life of college football hero Ernie Davis, the first African-American to win the Heisman Trophy.",English,"USA, Germany",1 win & 3 nominations.,"[{'Source': 'Internet Movie Database', 'Value': '7.3/10'}, {'Source': 'Rotten Tomatoes', 'Value': '61%'}, {'Source': 'Metacritic', 'Value': '58/100'}]",58,7.3,"18,828",tt0469903,movie,20 Jan 2009,"$9,589,875",Universal Pictures,N/A,True
The Sisterhood of the Traveling Pants 2,2008,PG-13,06 Aug 2008,119 min,"Comedy, Drama, Romance",Sanaa Hamri,"Elizabeth Chandler (screenplay), Ann Brashares (novel)","Amber Tamblyn, Alexis Bledel, America Ferrera, Blake Lively",Four college freshmen and best friends find that it may take more than a shared pair of jeans to help them stay in touch as their lives go in different directions.,"English, Greek",USA,1 nomination.,"[{'Source': 'Internet Movie Database', 'Value': '6.2/10'}, {'Source': 'Rotten Tomatoes', 'Value': '65%'}, {'Source': 'Metacritic', 'Value': '63/100'}]",63,6.2,"25,837",tt1018785,movie,18 Nov 2008,"$44,029,972",Warner Bros. Pictures,N/A,True
Cadillac Records,2008,R,05 Dec 2008,109 min,"Biography, Drama, Music",Darnell Martin,Darnell Martin,"Josh Alscher, Tim Bellow, Tony Bentley, Tammy Blanchard",Chronicles the rise of Chess Records and its recording artists.,English,USA,Nominated for 1 Golden Globe. Another 7 wins & 22 nominations.,"[{'Source': 'Internet Movie Database', 'Value': '7.0/10'}, {'Source': 'Rotten Tomatoes', 'Value': '67%'}, {'Source': 'Metacritic', 'Value': '65/100'}]",65,7.0,"18,593",tt1042877,movie,10 Mar 2009,"$8,134,217",Sony Pictures,N/A,True
The Other Man,2008,R,27 May 2009,88 min,"Drama, Mystery, Thriller",Richard Eyre,"Richard Eyre (screenplay), Charles Wood (screenplay), Bernhard Schlink (short story)","Laura Linney, Antonio Banderas, Liam Neeson, Romola Garai","The story of a husband who suspects his wife of adultery, and sets out to track down the other man in her life.",English,"UK, USA",N/A,"[{'Source': 'Internet Movie Database', 'Value': '5.4/10'}, {'Source': 'Rotten Tomatoes', 'Value': '15%'}, {'Source': 'Metacritic', 'Value': '34/100'}]",34,5.4,"10,707",tt0974613,movie,07 Apr 2009,N/A,Image Entertainment,N/A,True
Recep Ivedik,2008,N/A,22 Feb 2008,90 min,Comedy,Togan Gökbakar,"Serkan Altunigne (scenario), Mehmet Ali Bayhan, Sahan Gökbakar","Sahan Gökbakar, Fatma Toptas, Tulug Çizgen, Ismail Hakki Ürün","The movie is about a man trying to impress his childhood lover, although it may sound like a romantic movie, it is not. When Recep comes see's Sibel he starts to remember the old days, from...",Turkish,Turkey,N/A,"[{'Source': 'Internet Movie Database', 'Value': '4.6/10'}]",N/A,4.6,"22,216",tt1193516,movie,N/A,N/A,Kinostar,N/A,True
,,,,,,,,,,,,,,,,,,,,,,,False
