Title,Year,Rated,Released,Runtime,Genre,Director,Writer,Actors,Plot,Language,Country,Awards,Ratings,Metascore,imdbRating,imdbVotes,imdbID,Type,DVD,BoxOffice,Production,Website,Response
Rachel Getting Married,2008,R,31 Oct 2008,113 min,"Drama, Romance",Jonathan Demme,Jenny Lumet,"Sebastian Stan, Roslyn Ruff, Anne Hathaway, Bill Irwin","A young woman who has been in and out of rehab for the past ten years, returns home for the weekend for her sister's wedding.",English,USA,Nominated for 1 Oscar. Another 31 wins & 63 nominations.,"[{'Source': 'Internet Movie Database', 'Value': '6.7/10'}, {'Source': 'Rotten Tomatoes', 'Value': '84%'}, {'Source': 'Metacritic', 'Value': '82/100'}]",82,6.7,"45,541",tt1084950,movie,10 Mar 2009,"$12,748,504",Sony Pictures Classics,N/A,True
Step Up 2: The Streets,2008,PG-13,14 Feb 2008,98 min,"Drama, Music, Romance",Jon M. Chu,"Toni Ann Johnson, Karen Barna, Duane Adler (characters)","Briana Evigan, Robert Hoffman, Adam Sevani, Cassie Ventura",Romantic sparks occur between two dance students from different backgrounds at the Maryland School of the Arts.,"English, Russian",USA,2 wins & 3 nominations.,"[{'Source': 'Internet Movie Database', 'Value': '6.2/10'}, {'Source': 'Rotten Tomatoes', 'Value': '27%'}, {'Source': 'Metacritic', 'Value': '50/100'}]",50,6.2,"76,903",tt1023481,movie,15 Jul 2008,"$58,006,147",Touchstone Pictures,N/A,True
City of Ember,2008,PG,10 Oct 2008,90 min,"Adventure, Family, Fantasy, Sci-Fi",Gil Kenan,"Caroline Thompson (screenplay), Jeanne Duprau (book)","Saoirse Ronan, David Ryall, Harry Treadaway, Mary Kay Place","For generations, the people of the City of Ember have flourished in an amazing world of glittering lights. But Ember's once powerful generator is failing ... and the great lamps that illuminate the city are starting to flicker.",English,USA,6 nominations.,"[{'Source': 'Internet Movie Database', 'Value': '6.5/10'}, {'Source': 'Rotten Tomatoes', 'Value': '53%'}, {'Source': 'Metacritic', 'Value': '58/100'}]",58,6.5,"60,212",tt0970411,movie,20 Jan 2009,"$7,800,000",Fox Walden,N/A,True
,,,,,,,,,,,,,,,,,,,,,,,False
The Hottie & the Nottie,2008,PG-13,21 Feb 2008,91 min,"Comedy, Romance",Tom Putnam,Heidi Ferrer,"Paris Hilton, Joel David Moore, Christine Lakin, Johann Urb",A woman agrees to go on a date with a man only if he finds a suitor for her unattractive best friend.,English,USA,4 wins & 4 nominations.,"[{'Source': 'Internet Movie Database', 'Value': '1.9/10'}, {'Source': 'Rotten Tomatoes', 'Value': '5%'}, {'Source': 'Metacritic', 'Value': '7/100'}]",7,1.9,"35,586",tt0804492,movie,06 May 2008,N/A,Regent Releasing,N/A,True
Nick and Norah's Infinite Playlist,2008,PG-13,03 Oct 2008,90 min,"Comedy, Drama, Music, Romance",Peter Sollett,"Lorene Scafaria (screenplay), Rachel Cohn (novel), David Levithan (novel)","Michael Cera, Kat Dennings, Aaron Yoo, Rafi Gavron","High school student Nick O'Leary, member of the Queercore band The Jerk Offs, meets college-bound Norah Silverberg when she asks him to be her boyfriend for five minutes.",English,USA,9 nominations.,"[{'Source': 'Internet Movie Database', 'Value': '6.6/10'}, {'Source': 'Rotten Tomatoes', 'Value': '74%'}, {'Source': 'Metacritic', 'Value': '64/100'}]",64,6.6,"85,699",tt0981227,movie,03 Feb 2009,"$31,487,293",Sony Pictures/Screen Gems,N/A,True
Two Lovers,2008,R,20 Mar 2009,110 min,"Drama, Romance",James Gray,"James Gray, Ric Menello","Joaquin Phoenix, Anne Joyce, Elliot Villar, Craig Walker",A Brooklyn-set romantic drama about a bachelor torn between the family friend his parents wish he would marry and his beautiful but volatile new neighbor.,English,"USA, France",3 wins & 17 nominations.,"[{'Source': 'Internet Movie Database', 'Value': '7.0/10'}, {'Source': 'Rotten Tomatoes', 'Value': '82%'}, {'Source': 'Metacritic', 'Value': '74/100'}]",74,7.0,"34,913",tt1103275,movie,30 Jun 2009,"$2,997,417",Magnolia Pictures,N/A,True
Inkheart,2008,PG,23 Jan 2009,106 min,"Adventure, Family, Fantasy",Iain Softley,"David Lindsay-Abaire (screenplay), Cornelia Funke (novel)","Brendan Fraser, Sienna Guillory, Eliza Bennett, Richard Strange","A teenage girl discovers her father has an amazing talent to bring characters out of their books and must try to stop a freed villain from destroying them all, with the help of her father, her aunt, and a storybook's hero.",English,"Germany, UK, USA",1 win.,"[{'Source': 'Internet Movie Database', 'Value': '6.1/10'}, {'Source': 'Rotten Tomatoes', 'Value': '38%'}]",N/A,6.1,"70,102",tt0494238,movie,23 Jun 2009,"$17,281,832",Warner Bros. Pictures/New Line Cinema,N/A,True
Doomsday,2008,R,14 Mar 2008,105 min,"Action, Sci-Fi, Thriller",Neil Marshall,Neil Marshall,"Caryn Peterson, Adeola Ariyo, Emma Cleasby, Christine Tomlinson",A futuristic action thriller where a team of people work to prevent a disaster threatening the future of the human race.,English,"UK, USA, South Africa, Germany",1 nomination.,"[{'Source': 'Internet Movie Database', 'Value': '6.0/10'}, {'Source': 'Rotten Tomatoes', 'Value': '51%'}, {'Source': 'Metacritic', 'Value': '51/100'}]",51,6.0,"69,875",tt0483607,movie,29 Jul 2008,"$10,955,425",Universal Pictures,N/A,True
Madagascar: Escape 2 Africa,2008,PG,07 Nov 2008,89 min,"Animation, Adventure, Comedy, Family","Eric Darnell, Tom McGrath","Etan Cohen, Eric Darnell, Tom McGrath","Ben Stiller, Chris Rock, David Schwimmer, Jada Pinkett Smith","The Madagascar animals fly back to New York City, but crash-land on an African nature reserve, where they meet others of their own kind, and Alex especially discovers his royal heritage as prince of a lion pride.","English, Italian",USA,3 wins & 11 nominations.,"[{'Source': 'Internet Movie Database', 'Value': '6.6/10'}, {'Source': 'Rotten Tomatoes', 'Value': '64%'}, {'Source': 'Metacritic', 'Value': '61/100'}]",61,6.6,"188,324",tt0479952,movie,06 Feb 2009,"$179,982,968",Paramount Studios,N/A,True
Made of Honor,2008,PG-13,02 May 2008,101 min,"Comedy, Romance",Paul Weiland,"Adam Sztykiel (screenplay), Deborah Kaplan (screenplay), Harry Elfont (screenplay), Adam Sztykiel (story)","Patrick Dempsey, Michelle Monaghan, Kevin McKidd, Kadeem Hardison",A guy in love with an engaged woman tries to win her over after she asks him to be her maid of honor.,English,"USA, UK",1 win & 1 nomination.,"[{'Source': 'Internet Movie Database', 'Value': '5.9/10'}, {'Source': 'Rotten Tomatoes', 'Value': '15%'}, {'Source': 'Metacritic', 'Value': '37/100'}]",37,5.9,"63,941",tt0866439,movie,16 Sep 2008,"$46,012,734",Sony Pictures/Columbia,N/A,True
Mirrors,2008,R,15 Aug 2008,110 min,"Horror, Mystery",Alexandre Aja,"Alexandre Aja (screenplay), Grégory Levasseur (screenplay), Sung-ho Kim (Korean motion picture ""Into the Mirror"")","Kiefer Sutherland, Paula Patton, Cameron Boyce, Arika Gluck",An ex-cop and his family are the target of an evil force that is using mirrors as a gateway into their home.,English,"USA, Romania, Germany",2 nominations.,"[{'Source': 'Internet Movie Database', 'Value': '6.1/10'}, {'Source': 'Rotten Tomatoes', 'Value': '15%'}, {'Source': 'Metacritic', 'Value': '35/100'}]",35,6.1,"98,104",tt0790686,movie,13 Jan 2009,"$30,575,158",Buena Vista,N/A,True
Milk,2008,R,30 Jan 2009,128 min,"Biography, Drama",Gus Van Sant,Dustin Lance Black,"Sean Penn, Emile Hirsch, Josh Brolin, Diego Luna","The story of Harvey Milk, and his struggles as an American gay activist who fought for gay rights and became California's first openly gay elected official.",English,USA,Won 2 Oscars. Another 61 wins & 141 nominations.,"[{'Source': 'Internet Movie Database', 'Value': '7.5/10'}, {'Source': 'Rotten Tomatoes', 'Value': '93%'}, {'Source': 'Metacritic', 'Value': '84/100'}]",84,7.5,"157,933",tt1013753,movie,10 Mar 2009,"$31,716,847",Focus Features,N/A,True
Max Payne,2008,PG-13,17 Oct 2008,100 min,"Action, Crime, Drama, Thriller",John Moore,"Beau Thorne (screenplay), Sam Lake (video game by Remedy Entertainment and 3-D Realms Entertainment)","Mark Wahlberg, Mila Kunis, Beau Bridges, Ludacris","Coming together to solve a series of murders in New York City are a police detective whose family was slain as part of a conspiracy and an assassin out to avenge her sister's death. The duo will be hunted by the police, the mob, and a ruthless corporation.","English, Russian, Spanish","USA, Canada",1 nomination.,"[{'Source': 'Internet Movie Database', 'Value': '5.4/10'}, {'Source': 'Rotten Tomatoes', 'Value': '16%'}, {'Source': 'Metacritic', 'Value': '31/100'}]",31,5.4,"118,709",tt0467197,movie,20 Jan 2009,"$40,632,110",20th Century Fox,N/A,True
The Ruins,2008,R,04 Apr 2008,90 min,Horror,Carter Smith,"Scott B. Smith (screenplay), Scott B. Smith (novel)","Jonathan Tucker, Jena Malone, Laura Ramsey, Shawn Ashmore","A group of friends whose leisurely Mexican holiday takes a turn for the worse when they, along with a fellow tourist, embark on a remote archaeological dig in the jungle where something evil lives among the ruins.","English, Maya, Spanish, Greek, German","USA, Germany, Australia",6 nominations.,"[{'Source': 'Internet Movie Database', 'Value': '5.8/10'}, {'Source': 'Rotten Tomatoes', 'Value': '48%'}, {'Source': 'Metacritic', 'Value': '44/100'}]",44,5.8,"66,951",tt0963794,movie,08 Jul 2008,"$17,402,425",DreamWorks/Paramount Studios,N/A,True
Street Kings,2008,R,11 Apr 2008,109 min,"Action, Crime, Drama, Thriller",David Ayer,"James Ellroy (screenplay), Kurt Wimmer (screenplay), Jamie Moss (screenplay), James Ellroy (story)","Keanu Reeves, Forest Whitaker, Hugh Laurie, Chris Evans","An undercover cop, disillusioned by the death of his wife, is implicated in the murder of an officer and must struggle to clear himself.","English, Turkish",USA,1 nomination.,"[{'Source': 'Internet Movie Database', 'Value': '6.8/10'}, {'Source': 'Rotten Tomatoes', 'Value': '36%'}, {'Source': 'Metacritic', 'Value': '55/100'}]",55,6.8,"103,833",tt0421073,movie,19 Aug 2008,"$26,351,341",20th Century Fox/Regency Films,N/A,True
Lake Mungo,2008,R,29 Jan 2010,87 min,"Drama, Horror, Mystery, Thriller",Joel Anderson,Joel Anderson,"Rosie Traynor, David Pledger, Martin Sharpe, Talia Zucker",Strange things start happening after a girl is found drowned in a lake.,English,Australia,1 nomination.,"[{'Source': 'Internet Movie Database', 'Value': '6.2/10'}, {'Source': 'Rotten Tomatoes', 'Value': '94%'}]",N/A,6.2,"14,759",tt0816556,movie,23 Mar 2010,N/A,After Dark Films,N/A,True
The Midnight Meat Train,2008,R,16 May 2008,100 min,"Horror, Mystery",Ryûhei Kitamura,"Jeff Buhler (screenplay), Clive Barker (short story ""The Midnight Meat Train"")","Bradley Cooper, Leslie Bibb, Brooke Shields, Vinnie Jones","A photographer's obsessive pursuit of dark subject matter leads him into the path of a serial killer who stalks late night commuters, ultimately butchering them in the most gruesome ways imaginable.",English,USA,2 wins & 6 nominations.,"[{'Source': 'Internet Movie Database', 'Value': '6.1/10'}, {'Source': 'Rotten Tomatoes', 'Value': '72%'}, {'Source': 'Metacritic', 'Value': '58/100'}]",58,6.1,"56,455",tt0805570,movie,17 Feb 2009,"$34,394",Lionsgate Films,N/A,True
Harold,2008,PG-13,11 Jul 2008,90 min,Comedy,T. Sean Shannon,"T. Sean Shannon, Greg Fields","Cuba Gooding Jr., Spencer Breslin, Nikki Blonsky, Ally Sheedy",A teenager with an early onset of male-pattern baldness befriends his high school's janitor.,English,USA,N/A,"[{'Source': 'Internet Movie Database', 'Value': '5.5/10'}, {'Source': 'Rotten Tomatoes', 'Value': '31%'}, {'Source': 'Metacritic', 'Value': '10/100'}]",10,5.5,"1,813",tt1041753,movie,16 Sep 2008,N/A,Arsenal Pictures,N/A,True
Hunger,2008,Not Rated,31 Oct 2008,96 min,"Biography, Drama",Steve McQueen,"Enda Walsh, Steve McQueen","Stuart Graham, Laine Megaw, Brian Milligan, Liam McMahon",Irish republican Bobby Sands leads the inmates of a Northern Irish prison in a hunger strike.,"English, Irish","Ireland, UK",45 wins & 33 nominations.,"[{'Source': 'Internet Movie Database', 'Value': '7.6/10'}, {'Source': 'Rotten Tomatoes', 'Value': '90%'}, {'Source': 'Metacritic', 'Value': '82/100'}]",82,7.6,"62,123",tt0986233,movie,16 Feb 2010,N/A,IFC Films,N/A,True
The Forbidden Kingdom,2008,PG-13,18 Apr 2008,104 min,"Action, Adventure, Fantasy",Rob Minkoff,John Fusco,"Jet Li, Michael Angarano, Jackie Chan, Juana Collignon","A discovery made by a kung fu obsessed American teen sends him on an adventure to China, where he joins up with a band of martial arts warriors in order to free the imprisoned Monkey King.","English, Mandarin","USA, China",5 nominations.,"[{'Source': 'Internet Movie Database', 'Value': '6.6/10'}, {'Source': 'Rotten Tomatoes', 'Value': '64%'}, {'Source': 'Metacritic', 'Value': '57/100'}]",57,6.6,"97,814",tt0865556,movie,09 Sep 2008,"$40,044,561",Lionsgate,N/A,True
,,,,,,,,,,,,,,,,,,,,,,,False
Outlander,2008,R,11 Jul 2008,115 min,"Action, Adventure, Fantasy, Horror, Sci-Fi, War",Howard McCain,"Dirk Blackman, Howard McCain","Jim Caviezel, Sophia Myles, Jack Huston, John Hurt","During the reign of the Vikings, Kainan, a man from a far-off world, crash lands on Earth, bringing with him an alien predator known as the Moorwen. Though both man and monster are seeking revenge for violence committed against them, Kainan leads the alliance to kill the Moorwen by fusing his advanced technology with the Viking's Iron Age weaponry.","English, Norse,  Old, Latin","USA, Germany, France",1 nomination.,"[{'Source': 'Internet Movie Database', 'Value': '6.2/10'}, {'Source': 'Rotten Tomatoes', 'Value': '37%'}, {'Source': 'Metacritic', 'Value': '40/100'}]",40,6.2,"69,351",tt0462465,movie,26 May 2009,"$59,581",Third Rail Releasing,N/A,True
Horton Hears a Who!,2008,G,14 Mar 2008,86 min,"Animation, Adventure, Comedy, Family, Fantasy","Jimmy Hayward, Steve Martino","Cinco Paul (screenplay by), Ken Daurio (screenplay by), Dr. Seuss (based upon the book by)","Jim Carrey, Steve Carell, Carol Burnett, Will Arnett",Horton the Elephant struggles to protect a microscopic community from his neighbors who refuse to believe it exists.,English,USA,1 win & 18 nominations.,"[{'Source': 'Internet Movie Database', 'Value': '6.8/10'}, {'Source': 'Rotten Tomatoes', 'Value': '79%'}, {'Source': 'Metacritic', 'Value': '71/100'}]",71,6.8,"123,411",tt0451079,movie,09 Dec 2008,"$154,388,002",20th Century Fox,N/A,True
Lakeview Terrace,2008,PG-13,19 Sep 2008,110 min,"Crime, Drama, Thriller",Neil LaBute,"David Loughery (screenplay), Howard Korder (screenplay), David Loughery (story)","Samuel L. Jackson, Patrick Wilson, Kerry Washington, Ron Glass","Based on a true story, a troubled and racist African-American L.A.P.D. Officer will stop at nothing to force out a friendly interracial couple who just moved in next door to him.",English,USA,1 nomination.,"[{'Source': 'Internet Movie Database', 'Value': '6.1/10'}, {'Source': 'Rotten Tomatoes', 'Value': '44%'}, {'Source': 'Metacritic', 'Value': '47/100'}]",47,6.1,"46,865",tt0947802,movie,27 Jan 2009,"$39,263,506",Sony Pictures/Screen Gems,N/A,True
Mad Money,2008,PG-13,18 Jan 2008,104 min,"Comedy, Crime, Thriller",Callie Khouri,"Glenn Gers (screenplay), John Mister (earlier screenplay), Neil McKay (screenplay ""Hot Money""), Terry Winsor (screenplay ""Hot Money"")","Diane Keaton, Ted Danson, Katie Holmes, Adam Rothenberg",Three female employees of the Federal Reserve plot to steal money that is about to be destroyed.,English,USA,2 nominations.,"[{'Source': 'Internet Movie Database', 'Value': '5.8/10'}, {'Source': 'Rotten Tomatoes', 'Value': '22%'}, {'Source': 'Metacritic', 'Value': '41/100'}]",41,5.8,"19,487",tt0951216,movie,13 May 2008,"$20,536,106",Overture Films,N/A,True
Passengers,2008,PG-13,26 Sep 2008,93 min,"Drama, Fantasy, Horror, Mystery, Romance, Thriller",Rodrigo García,Ronnie Christensen,"Anne Hathaway, Patrick Wilson, Andre Braugher, Dianne Wiest",A grief counselor working with a group of plane-crash survivors finds herself at the root of a mystery when her clients begin to disappear.,English,"USA, Canada",N/A,"[{'Source': 'Internet Movie Database', 'Value': '5.9/10'}, {'Source': 'Rotten Tomatoes', 'Value': '19%'}, {'Source': 'Metacritic', 'Value': '40/100'}]",40,5.9,"32,458",tt0449487,movie,24 Mar 2009,"$270,659",Sony Pictures/TriStar Pictures,N/A,True
Frost/Nixon,2008,R,23 Jan 2009,122 min,"Biography, Drama, History",Ron Howard,"Peter Morgan (screenplay), Peter Morgan (play)","Frank Langella, Michael Sheen, Sam Rockwell, Kevin Bacon",A dramatic retelling of the post-Watergate television interviews between British talk-show host David Frost and former president Richard Nixon.,English,"UK, France, USA",Nominated for 5 Oscars. Another 21 wins & 71 nominations.,"[{'Source': 'Internet Movie Database', 'Value': '7.7/10'}, {'Source': 'Rotten Tomatoes', 'Value': '93%'}, {'Source': 'Metacritic', 'Value': '80/100'}]",80,7.7,"97,964",tt0870111,movie,21 Apr 2009,"$18,600,000",Universal Pictures,N/A,True
Saw V,2008,R,24 Oct 2008,92 min,"Horror, Mystery, Thriller",David Hackl,"Patrick Melton (screenplay), Marcus Dunstan (screenplay)","Tobin Bell, Costas Mandylor, Scott Patterson, Betsy Russell","Following Jigsaw's grisly demise, Mark Hoffman is commended as a hero, but Agent Strahm is suspicious, and delves into Hoffman's past. Meanwhile, another group of people are put through a series of gruesome tests.",English,"USA, Canada",1 win & 1 nomination.,"[{'Source': 'Internet Movie Database', 'Value': '5.8/10'}, {'Source': 'Rotten Tomatoes', 'Value': '13%'}, {'Source': 'Metacritic', 'Value': '20/100'}]",20,5.8,"108,285",tt1132626,movie,20 Jan 2009,"$56,729,973",Lionsgate,N/A,True
"Angus, Thongs and Perfect Snogging",2008,PG-13,25 Jul 2008,100 min,"Comedy, Drama, Romance",Gurinder Chadha,"Gurinder Chadha (screenplay), Paul Mayeda Berges (screenplay), Will McRobb (screenplay), Chris Viscardi (screenplay), Louise Rennison (books)","Georgia Groome, Aaron Taylor-Johnson, Karen Taylor, Alan Davies","The story centers on a 14-year-old girl who keeps a diary about the ups and downs of being a teenager, including the things she learns about kissing.",English,"USA, Germany, UK",3 wins & 1 nomination.,"[{'Source': 'Internet Movie Database', 'Value': '6.3/10'}, {'Source': 'Rotten Tomatoes', 'Value': '72%'}]",N/A,6.3,"24,281",tt0963743,movie,22 Dec 2009,N/A,Nickelodeon Movies,N/A,True
Punisher: War Zone,2008,R,05 Dec 2008,103 min,"Action, Crime, Drama, Thriller",Lexi Alexander,"Nick Santora, Art Marcum, Matt Holloway","Ray Stevenson, Dominic West, Doug Hutchison, Colin Salmon","Frank Castle known as Punisher ruthlessly demolishes organized crime, but it starts an even bigger war.",English,"USA, Canada, Germany",1 win & 1 nomination.,"[{'Source': 'Internet Movie Database', 'Value': '5.9/10'}, {'Source': 'Rotten Tomatoes', 'Value': '29%'}, {'Source': 'Metacritic', 'Value': '30/100'}]",30,5.9,"58,057",tt0450314,movie,17 Mar 2009,"$7,948,159",Lionsgate,N/A,True
Transporter 3,2008,PG-13,26 Nov 2008,104 min,"Action, Thriller",Olivier Megaton,"Luc Besson, Robert Mark Kamen, Luc Besson (characters), Robert Mark Kamen (characters)","Jason Statham, Natalya Rudakova, François Berléand, Robert Knepper","Frank Martin puts the driving gloves on to deliver Valentina, the kidnapped daughter of a Ukrainian government official, from Marseilles to Odessa on the Black Sea. En route, he has to contend with thugs who want to intercept Valentina's safe delivery and not let his personal feelings get in the way of his dangerous objective.","English, French, Ukrainian, Russian, Hungarian","France, USA, Ukraine",2 nominations.,"[{'Source': 'Internet Movie Database', 'Value': '6.1/10'}, {'Source': 'Rotten Tomatoes', 'Value': '39%'}, {'Source': 'Metacritic', 'Value': '51/100'}]",51,6.1,"149,825",tt1129442,movie,10 Mar 2009,"$31,316,973",Lionsgate Films,N/A,True
Meet the Spartans,2008,PG-13,25 Jan 2008,86 min,Comedy,"Jason Friedberg, Aaron Seltzer","Jason Friedberg, Aaron Seltzer","Sean Maguire, Carmen Electra, Ken Davitian, Kevin Sorbo","A spoof of 300 (2006) and many other movies, TV series/shows/commercials, video games and celebrities. King Leonidas of Sparta and his army of 12 go to war against Xerxes of Persia to fight to the death for Sparta's freedom.",English,USA,6 nominations.,"[{'Source': 'Internet Movie Database', 'Value': '2.8/10'}, {'Source': 'Rotten Tomatoes', 'Value': '2%'}, {'Source': 'Metacritic', 'Value': '9/100'}]",9,2.8,"98,498",tt1073498,movie,03 Jun 2008,"$38,200,000",20th Century Fox,N/A,True
Ghajini,2008,Not Rated,24 Dec 2008,183 min,"Action, Drama, Mystery, Thriller",A.R. Murugadoss,"Piyush Mishra (dialogue), A.R. Murugadoss (story and screenplay), Christopher Nolan (based on a screenplay by), Jonathan Nolan (adapted from the short story by)","Aamir Khan, Asin, Jiah Khan, Tinnu Anand",A short-term memory loss patient sets out on his journey to avenge the death of his beloved girl.,"Hindi, Urdu",India,7 wins & 18 nominations.,"[{'Source': 'Internet Movie Database', 'Value': '7.3/10'}, {'Source': 'Rotten Tomatoes', 'Value': '50%'}]",N/A,7.3,"53,009",tt1166100,movie,24 Mar 2009,"$2,411,071",Adlab Films,N/A,True
,,,,,,,,,,,,,,,,,,,,,,,False
Tokyo!,2008,Unrated,16 Aug 2008,112 min,"Comedy, Drama, Fantasy","Joon-ho Bong, Leos Carax, Michel Gondry","Gabrielle Bell (graphic novel ""Cecil and Jordan in New York""), Joon-ho Bong, Leos Carax, Michel Gondry","Ayako Fujitani, Ryo Kase, Ayumi Itô, Nao Ohmori",A cinematic triptych of three Tokyo-set stories.,"Japanese, French, English","France, Japan, South Korea, Germany",2 wins & 3 nominations.,"[{'Source': 'Internet Movie Database', 'Value': '7.1/10'}, {'Source': 'Rotten Tomatoes', 'Value': '76%'}, {'Source': 'Metacritic', 'Value': '63/100'}]",63,7.1,"8,810",tt0976060,movie,30 Jun 2009,"$300,000",Vitagraph Films,N/A,True
Mirrors,2008,R,15 Aug 2008,110 min,"Horror, Mystery",Alexandre Aja,"Alexandre Aja (screenplay), Grégory Levasseur (screenplay), Sung-ho Kim (Korean motion picture ""Into the Mirror"")","Kiefer Sutherland, Paula Patton, Cameron Boyce, Arika Gluck",An ex-cop and his family are the target of an evil force that is using mirrors as a gateway into their home.,English,"USA, Romania, Germany",2 nominations.,"[{'Source': 'Internet Movie Database', 'Value': '6.1/10'}, {'Source': 'Rotten Tomatoes', 'Value': '15%'}, {'Source': 'Metacritic', 'Value': '35/100'}]",35,6.1,"98,104",tt0790686,movie,13 Jan 2009,"$30,575,158",Buena Vista,N/A,True
Milk,2008,R,30 Jan 2009,128 min,"Biography, Drama",Gus Van Sant,Dustin Lance Black,"Sean Penn, Emile Hirsch, Josh Brolin, Diego Luna","The story of Harvey Milk, and his struggles as an American gay activist who fought for gay rights and became California's first openly gay elected official.",English,USA,Won 2 Oscars. Another 61 wins & 141 nominations.,"[{'Source': 'Internet Movie Database', 'Value': '7.5/10'}, {'Source': 'Rotten Tomatoes', 'Value': '93%'}, {'Source': 'Metacritic', 'Value': '84/100'}]",84,7.5,"157,933",tt1013753,movie,10 Mar 2009,"$31,716,847",Focus Features,N/A,True
Max Payne,2008,PG-13,17 Oct 2008,100 min,"Action, Crime, Drama, Thriller",John Moore,"Beau Thorne (screenplay), Sam Lake (video game by Remedy Entertainment and 3-D Realms Entertainment)","Mark Wahlberg, Mila Kunis, Beau Bridges, Ludacris","Coming together to solve a series of murders in New York City are a police detective whose family was slain as part of a conspiracy and an assassin out to avenge her sister's death. The duo will be hunted by the police, the mob, and a ruthless corporation.","English, Russian, Spanish","USA, Canada",1 nomination.,"[{'Source': 'Internet Movie Database', 'Value': '5.4/10'}, {'Source': 'Rotten Tomatoes', 'Value': '16%'}, {'Source': 'Metacritic', 'Value': '31/100'}]",31,5.4,"118,709",tt0467197,movie,20 Jan 2009,"$40,632,110",20th Century Fox,N/A,True
The Ruins,2008,R,04 Apr 2008,90 min,Horror,Carter Smith,"Scott B. Smith (screenplay), Scott B. Smith (novel)","Jonathan Tucker, Jena Malone, Laura Ramsey, Shawn Ashmore","A group of friends whose leisurely Mexican holiday takes a turn for the worse when they, along with a fellow tourist, embark on a remote archaeological dig in the jungle where something evil lives among the ruins.","English, Maya, Spanish, Greek, German","USA, Germany, Australia",6 nominations.,"[{'Source': 'Internet Movie Database', 'Value': '5.8/10'}, {'Source': 'Rotten Tomatoes', 'Value': '48%'}, {'Source': 'Metacritic', 'Value': '44/100'}]",44,5.8,"66,951",tt0963794,movie,08 Jul 2008,"$17,402,425",DreamWorks/Paramount Studios,N/A,True
Street Kings,2008,R,11 Apr 2008,109 min,"Action, Crime, Drama, Thriller",David Ayer,"James Ellroy (screenplay), Kurt Wimmer (screenplay), Jamie Moss (screenplay), James Ellroy (story)","Keanu Reeves, Forest Whitaker, Hugh Laurie, Chris Evans","An undercover cop, disillusioned by the death of his wife, is implicated in the murder of an officer and must struggle to clear himself.","English, Turkish",USA,1 nomination.,"[{'Source': 'Internet Movie Database', 'Value': '6.8/10'}, {'Source': 'Rotten Tomatoes', 'Value': '36%'}, {'Source': 'Metacritic', 'Value': '55/100'}]",55,6.8,"103,833",tt0421073,movie,19 Aug 2008,"$26,351,341",20th Century Fox/Regency Films,N/A,True
Lake Mungo,2008,R,29 Jan 2010,87 min,"Drama, Horror, Mystery, Thriller",Joel Anderson,Joel Anderson,"Rosie Traynor, David Pledger, Martin Sharpe, Talia Zucker",Strange things start happening after a girl is found drowned in a lake.,English,Australia,1 nomination.,"[{'Source': 'Internet Movie Database', 'Value': '6.2/10'}, {'Source': 'Rotten Tomatoes', 'Value': '94%'}]",N/A,6.2,"14,759",tt0816556,movie,23 Mar 2010,N/A,After Dark Films,N/A,True
