Title,Year,Rated,Released,Runtime,Genre,Director,Writer,Actors,Plot,Language,Country,Awards,Ratings,Metascore,imdbRating,imdbVotes,imdbID,Type,DVD,BoxOffice,Production,Website,Response
The Whole Ten Yards,2004,PG-13,09 Apr 2004,98 min,"Comedy, Crime, Thriller",Howard Deutch,"Mitchell Kapner (characters), Mitchell Kapner (story), George Gallo (screenplay)","Bruce Willis, Matthew Perry, Amanda Peet, Kevin Pollak","Jimmy the Tulip's (Willis) quiet new life is shaken up by his old pal Oz (Perry), whose wife (Henstridge) has been kidnapped by a Hungarian mob. The Tulip and his wife Jill (Peet) spring into action.","English, Hungarian, Hebrew",USA,1 win & 1 nomination.,"[{'Source': 'Internet Movie Database', 'Value': '5.5/10'}, {'Source': 'Rotten Tomatoes', 'Value': '4%'}, {'Source': 'Metacritic', 'Value': '24/100'}]",24,5.5,"52,018",tt0327247,movie,27 Jul 2004,"$16,247,590",Warner Bros.,N/A,True
A Good Woman,2004,PG,13 May 2005,93 min,"Drama, Comedy, Romance",Mike Barker,"Oscar Wilde (play), Howard Himelstein (screenplay)","Helen Hunt, Scarlett Johansson, Milena Vukotic, Stephen Campbell Moore","While retaining her secret identity, the illustrious Mrs. Erlynne (Helen Hunt) saves Lady Windemere (Scarlett Johansson) from making a grand social faux-pas with the scoundrelly Lord Darlington (Stephen Campbell Moore).","English, Italian","UK, Italy, Spain, Luxembourg, USA",N/A,"[{'Source': 'Internet Movie Database', 'Value': '6.5/10'}, {'Source': 'Rotten Tomatoes', 'Value': '38%'}, {'Source': 'Metacritic', 'Value': '53/100'}]",53,6.5,"10,935",tt0379306,movie,13 Jun 2006,"$97,060",Lions Gate Films,N/A,True
,,,,,,,,,,,,,,,,,,,,,,,False
She Hate Me,2004,R,30 Jul 2004,138 min,"Comedy, Drama",Spike Lee,"Michael Genet (story), Michael Genet (screenplay), Spike Lee (screenplay)","Anthony Mackie, Kerry Washington, Ellen Barkin, Monica Bellucci","Fired from his job for exposing corrupt business practices, a former biotech executive turns to impregnating wealthy lesbians for profit.","English, German, Spanish",USA,1 win & 7 nominations.,"[{'Source': 'Internet Movie Database', 'Value': '5.3/10'}, {'Source': 'Rotten Tomatoes', 'Value': '19%'}, {'Source': 'Metacritic', 'Value': '28/100'}]",28,5.3,"6,992",tt0384533,movie,01 Feb 2005,"$81,367",Sony Pictures Classics,N/A,True
Cellular,2004,PG-13,10 Sep 2004,94 min,"Action, Crime, Thriller",David R. Ellis,"Larry Cohen (story), Chris Morgan (screenplay)","Caroline Aaron, Kim Basinger, Brenda Ballard, Will Beinbrink",A young man receives an emergency phone call on his cell phone from an older woman. The catch? The woman claims to have been kidnapped; and the kidnappers have targeted her husband and child next.,English,"USA, Germany",2 nominations.,"[{'Source': 'Internet Movie Database', 'Value': '6.5/10'}, {'Source': 'Rotten Tomatoes', 'Value': '55%'}, {'Source': 'Metacritic', 'Value': '60/100'}]",60,6.5,"88,721",tt0337921,movie,18 Jan 2005,"$32,003,620",New Line Cinema,N/A,True
Ladder 49,2004,PG-13,01 Oct 2004,115 min,"Drama, Thriller",Jay Russell,Lewis Colick,"Joaquin Phoenix, John Travolta, Jacinda Barrett, Robert Patrick","A firefighter, injured and trapped in a burning building, has flashbacks of his life as he drifts in and out of consciousness. Meanwhile, fellow firefighters led by the Chief attempt to rescue him.",English,USA,1 win & 6 nominations.,"[{'Source': 'Internet Movie Database', 'Value': '6.5/10'}, {'Source': 'Rotten Tomatoes', 'Value': '41%'}, {'Source': 'Metacritic', 'Value': '47/100'}]",47,6.5,"53,203",tt0349710,movie,08 Mar 2005,"$74,463,263",Buena Vista,N/A,True
Raising Helen,2004,PG-13,28 May 2004,119 min,"Comedy, Drama, Romance",Garry Marshall,"Patrick J. Clifton (story), Beth Rigazio (story), Jack Amiel (screenplay), Michael Begler (screenplay)","Kate Hudson, John Corbett, Joan Cusack, Hayden Panettiere","After her sister and brother-in-law die in a car accident, a young woman becomes the guardian of their three children.",English,USA,1 nomination.,"[{'Source': 'Internet Movie Database', 'Value': '6.0/10'}, {'Source': 'Rotten Tomatoes', 'Value': '25%'}, {'Source': 'Metacritic', 'Value': '38/100'}]",38,6.0,"34,207",tt0350028,movie,12 Oct 2004,"$37,379,556",Buena Vista Pictures,N/A,True
A Dirty Shame,2004,NC-17,24 Sep 2004,89 min,Comedy,John Waters,John Waters,"Tracey Ullman, Johnny Knoxville, Selma Blair, Chris Isaak","An uptight, middle-aged, repressed woman turns into a sex addict after getting hit on the head, and she then falls into an underground subculture of sex addicts in suburban Baltimore.",English,USA,1 win.,"[{'Source': 'Internet Movie Database', 'Value': '5.1/10'}, {'Source': 'Metacritic', 'Value': '56/100'}]",56,5.1,"11,756",tt0365125,movie,26 Sep 2006,N/A,N/A,N/A,True
,,,,,,,,,,,,,,,,,,,,,,,False
The Alamo,2004,PG-13,09 Apr 2004,137 min,"Drama, History, War, Western",John Lee Hancock,"Leslie Bohem, Stephen Gaghan, John Lee Hancock","Dennis Quaid, Billy Bob Thornton, Jason Patric, Patrick Wilson","Based on the 1836 standoff between a group of Texan and Tejano men, led by Davy Crockett and Jim Bowie, and Mexican dictator Santa Anna's forces at the Alamo in San Antonio Texas.","English, Spanish",USA,1 nomination.,"[{'Source': 'Internet Movie Database', 'Value': '6.0/10'}, {'Source': 'Metacritic', 'Value': '47/100'}]",47,6.0,"18,815",tt0318974,movie,28 Sep 2004,N/A,N/A,N/A,True
Mindhunters,2004,R,13 May 2005,106 min,"Crime, Horror, Mystery, Thriller",Renny Harlin,"Wayne Kramer (story), Wayne Kramer (screenplay), Kevin Brodbin (screenplay)","Eion Bailey, Clifton Collins Jr., Will Kemp, Val Kilmer",Trainees in the FBI's psychological profiling program must put their training into practice when they discover a killer in their midst.,English,"Netherlands, UK, Finland, USA",4 nominations.,"[{'Source': 'Internet Movie Database', 'Value': '6.4/10'}, {'Source': 'Rotten Tomatoes', 'Value': '24%'}, {'Source': 'Metacritic', 'Value': '33/100'}]",33,6.4,"55,650",tt0297284,movie,20 Sep 2005,N/A,Miramax,N/A,True
The Heart Is Deceitful Above All Things,2004,R,19 Jan 2005,97 min,Drama,Asia Argento,"Laura Albert (short stories), Asia Argento (screenplay), Alessandro Magania","Asia Argento, Jimmy Bennett, Kara Kemp, Brent Almond","Seven-year-old Jeremiah is pulled from his foster home and thrown into a troubled life on the road with his teenage mother, Sarah.",English,"USA, UK, France, Japan",1 win & 2 nominations.,"[{'Source': 'Internet Movie Database', 'Value': '6.5/10'}, {'Source': 'Rotten Tomatoes', 'Value': '41%'}, {'Source': 'Metacritic', 'Value': '27/100'}]",27,6.5,"6,134",tt0368774,movie,06 Jun 2006,N/A,Palm Pictures,N/A,True
The Merchant of Venice,2004,R,18 Feb 2005,131 min,"Drama, Romance",Michael Radford,"William Shakespeare (play), Michael Radford (screenplay)","Al Pacino, Jeremy Irons, Joseph Fiennes, Lynn Collins","In 16th century Venice, when a merchant must default on a large loan from an abused Jewish moneylender for a friend with romantic ambitions, the bitterly vengeful creditor demands a gruesome payment instead.","English, Italian","USA, Italy, Luxembourg, UK",Nominated for 1 BAFTA Film Award. Another 2 wins & 6 nominations.,"[{'Source': 'Internet Movie Database', 'Value': '7.0/10'}, {'Source': 'Rotten Tomatoes', 'Value': '71%'}, {'Source': 'Metacritic', 'Value': '63/100'}]",63,7.0,"33,429",tt0379889,movie,10 May 2005,"$3,300,000",Sony Pictures Classics,N/A,True
Mar adentro,2004,N/A,01 Oct 2004,19 min,"Drama, Romance, Short",Mariana Chenillo,Mariana Chenillo,"Kevin Amper, Fernando Becerril, Verónica Langer, Ilana Pupko",Ramón Sampedro is a Spanish ship mechanic and part-time poet who is left a quadriplegic after a diving accident. This film tells the true story of Sampedro's 30-year battle for the legal right to end his own life.,Spanish,Mexico,N/A,"[{'Source': 'Internet Movie Database', 'Value': '7.5/10'}, {'Source': 'Rotten Tomatoes', 'Value': '84%'}]",N/A,7.5,36,tt0427498,movie,17 May 2005,"$1,870,746",Fine Line Features,N/A,True
,,,,,,,,,,,,,,,,,,,,,,,False
Gegen die Wand: Making of,2004,N/A,11 Mar 2004,29 min,"Documentary, Short",Türker Süer,Türker Süer,"Fatih Akin, Sibel Kekilli, Birol Ünel",Against the wall: Making of.,German,Germany,N/A,"[{'Source': 'Internet Movie Database', 'Value': '7.5/10'}]",N/A,7.5,17,tt8164566,movie,N/A,N/A,N/A,N/A,True
Alfie,2004,R,05 Nov 2004,103 min,"Comedy, Drama, Romance",Charles Shyer,"Bill Naughton (play), Bill Naughton (earlier screenplay), Elaine Pope (screenplay), Charles Shyer (screenplay)","Jude Law, Renée Taylor, Jane Krakowski, Jeff Harding",A cockney womanizer learns the hard way about the dangers of his actions.,English,"UK, USA",Won 1 Golden Globe. Another 6 wins & 7 nominations.,"[{'Source': 'Internet Movie Database', 'Value': '6.2/10'}, {'Source': 'Rotten Tomatoes', 'Value': '48%'}, {'Source': 'Metacritic', 'Value': '49/100'}]",49,6.2,"48,673",tt0375173,movie,15 Mar 2005,"$13,351,235",Paramount Pictures,N/A,True
Antares,2004,Unrated,03 Dec 2004,105 min,"Drama, Romance",Götz Spielmann,Götz Spielmann,"Petra Morzé, Andreas Patton, Hary Prinz, Susanne Wuest","A deadly car crash sets off three parallel stories of women at crisis points, faltering behind the doors of the same, plain Vienna apartment block. A bored nurse with a stable, comfortable ...","German, Croatian, English",Austria,2 wins & 5 nominations.,"[{'Source': 'Internet Movie Database', 'Value': '6.1/10'}, {'Source': 'Rotten Tomatoes', 'Value': '0%'}]",N/A,6.1,"2,518",tt0419449,movie,28 Mar 2006,N/A,Film Movement,N/A,True
Mean Creek,2004,R,29 Sep 2004,90 min,"Crime, Drama",Jacob Estes,Jacob Estes,"Rory Culkin, Ryan Kelley, Scott Mechlowicz, Trevor Morgan","When a teen is bullied, his brother and friends lure the bully into the woods to seek revenge.",English,USA,4 wins & 6 nominations.,"[{'Source': 'Internet Movie Database', 'Value': '7.2/10'}, {'Source': 'Rotten Tomatoes', 'Value': '89%'}, {'Source': 'Metacritic', 'Value': '74/100'}]",74,7.2,"29,560",tt0377091,movie,25 Jan 2005,"$295,919",Paramount Classics,N/A,True
Les Choristes: Le making of,2004,N/A,27 Oct 2004,72 min,Documentary,Daniel Deleforges,N/A,"Christophe Barratier, François Berléand, Marie Bunel, François Chauvaud",A conducteur of an orchestra meets a former teacher of the reform school of his childhood. This visit brings out from his the memories of a failed composer who put joy in their life thanks to music.,French,France,N/A,"[{'Source': 'Internet Movie Database', 'Value': '8.3/10'}]",N/A,8.3,393,tt1754108,movie,N/A,N/A,N/A,N/A,True
2046,2004,R,29 Sep 2004,129 min,"Drama, Romance, Sci-Fi",Kar-Wai Wong,Kar-Wai Wong (screenplay),"Tony Chiu-Wai Leung, Li Gong, Faye Wong, Takuya Kimura","Several women enter a science fiction author's life over the course of a few years, after the author has lost the woman he considers his one true love.","Cantonese, Japanese, Mandarin","Hong Kong, China, France, Italy, Germany",35 wins & 77 nominations.,"[{'Source': 'Internet Movie Database', 'Value': '7.4/10'}, {'Source': 'Rotten Tomatoes', 'Value': '86%'}, {'Source': 'Metacritic', 'Value': '78/100'}]",78,7.4,"47,619",tt0212712,movie,26 Dec 2005,"$1,237,566",Sony Pictures Classics,N/A,True
The Woodsman,2004,R,21 Jan 2005,87 min,Drama,Nicole Kassell,"Steven Fechter (play), Nicole Kassell (screenplay), Steven Fechter (screenplay)","Kevin Bacon, David Alan Grier, Eve, Kyra Sedgwick",A child molester returns to his hometown after 12 years in prison and attempts to start a new life.,English,USA,7 wins & 20 nominations.,"[{'Source': 'Internet Movie Database', 'Value': '7.2/10'}, {'Source': 'Rotten Tomatoes', 'Value': '88%'}, {'Source': 'Metacritic', 'Value': '72/100'}]",72,7.2,"30,723",tt0361127,movie,12 Apr 2005,"$1,456,291",Newmarket Films,N/A,True
Noel,2004,PG,26 Nov 2004,96 min,Drama,Chazz Palminteri,David Hubbard,"Susan Sarandon, Paul Walker, Penélope Cruz, Alan Arkin","Five New Yorkers come together on Christmas Eve, seeking a miracle.",English,"USA, Canada",N/A,"[{'Source': 'Internet Movie Database', 'Value': '6.2/10'}, {'Source': 'Rotten Tomatoes', 'Value': '28%'}, {'Source': 'Metacritic', 'Value': '29/100'}]",29,6.2,"8,438",tt0383534,movie,25 Oct 2005,N/A,Convex Group,N/A,True
Wimbledon,2004,PG-13,17 Sep 2004,98 min,"Comedy, Romance, Sport",Richard Loncraine,"Adam Brooks, Jennifer Flackett, Mark Levin","Kirsten Dunst, Paul Bettany, Sam Neill, Jon Favreau","A pro tennis player has lost his ambition and has fallen in rank to 119. Fortunately for him, he meets a young player on the women's circuit who helps him recapture his focus for Wimbledon.","English, Italian","UK, France, USA",1 nomination.,"[{'Source': 'Internet Movie Database', 'Value': '6.3/10'}, {'Source': 'Rotten Tomatoes', 'Value': '61%'}, {'Source': 'Metacritic', 'Value': '59/100'}]",59,6.3,"57,260",tt0360201,movie,28 Dec 2004,"$16,831,505",Universal Pictures,N/A,True
I Heart Huckabees,2004,R,22 Oct 2004,107 min,Comedy,David O. Russell,"David O. Russell, Jeff Baena","Jason Schwartzman, Isabelle Huppert, Dustin Hoffman, Lily Tomlin","A husband-and-wife team play detective, but not in the traditional sense. Instead, the happy duo helps others solve their existential issues, the kind that keep you up at night, wondering what it all means.","English, French, Spanish","UK, Germany, USA",3 wins & 11 nominations.,"[{'Source': 'Internet Movie Database', 'Value': '6.6/10'}, {'Source': 'Rotten Tomatoes', 'Value': '63%'}, {'Source': 'Metacritic', 'Value': '55/100'}]",55,6.6,"60,759",tt0356721,movie,22 Feb 2005,"$12,711,889",Fox Searchlight,N/A,True
The Whole Ten Yards,2004,PG-13,09 Apr 2004,98 min,"Comedy, Crime, Thriller",Howard Deutch,"Mitchell Kapner (characters), Mitchell Kapner (story), George Gallo (screenplay)","Bruce Willis, Matthew Perry, Amanda Peet, Kevin Pollak","Jimmy the Tulip's (Willis) quiet new life is shaken up by his old pal Oz (Perry), whose wife (Henstridge) has been kidnapped by a Hungarian mob. The Tulip and his wife Jill (Peet) spring into action.","English, Hungarian, Hebrew",USA,1 win & 1 nomination.,"[{'Source': 'Internet Movie Database', 'Value': '5.5/10'}, {'Source': 'Rotten Tomatoes', 'Value': '4%'}, {'Source': 'Metacritic', 'Value': '24/100'}]",24,5.5,"52,018",tt0327247,movie,27 Jul 2004,"$16,247,590",Warner Bros.,N/A,True
A Good Woman,2004,PG,13 May 2005,93 min,"Drama, Comedy, Romance",Mike Barker,"Oscar Wilde (play), Howard Himelstein (screenplay)","Helen Hunt, Scarlett Johansson, Milena Vukotic, Stephen Campbell Moore","While retaining her secret identity, the illustrious Mrs. Erlynne (Helen Hunt) saves Lady Windemere (Scarlett Johansson) from making a grand social faux-pas with the scoundrelly Lord Darlington (Stephen Campbell Moore).","English, Italian","UK, Italy, Spain, Luxembourg, USA",N/A,"[{'Source': 'Internet Movie Database', 'Value': '6.5/10'}, {'Source': 'Rotten Tomatoes', 'Value': '38%'}, {'Source': 'Metacritic', 'Value': '53/100'}]",53,6.5,"10,935",tt0379306,movie,13 Jun 2006,"$97,060",Lions Gate Films,N/A,True
,,,,,,,,,,,,,,,,,,,,,,,False
She Hate Me,2004,R,30 Jul 2004,138 min,"Comedy, Drama",Spike Lee,"Michael Genet (story), Michael Genet (screenplay), Spike Lee (screenplay)","Anthony Mackie, Kerry Washington, Ellen Barkin, Monica Bellucci","Fired from his job for exposing corrupt business practices, a former biotech executive turns to impregnating wealthy lesbians for profit.","English, German, Spanish",USA,1 win & 7 nominations.,"[{'Source': 'Internet Movie Database', 'Value': '5.3/10'}, {'Source': 'Rotten Tomatoes', 'Value': '19%'}, {'Source': 'Metacritic', 'Value': '28/100'}]",28,5.3,"6,992",tt0384533,movie,01 Feb 2005,"$81,367",Sony Pictures Classics,N/A,True
The Forgotten,2004,PG-13,24 Sep 2004,91 min,"Drama, Horror, Mystery, Sci-Fi, Thriller",Joseph Ruben,Gerald Di Pego,"Julianne Moore, Christopher Kovaleski, Matthew Pleszewicz, Anthony Edwards","After being told that their children never existed, a man and woman soon discover there is a much bigger enemy at work.",English,USA,7 nominations.,"[{'Source': 'Internet Movie Database', 'Value': '5.8/10'}, {'Source': 'Rotten Tomatoes', 'Value': '32%'}, {'Source': 'Metacritic', 'Value': '43/100'}]",43,5.8,"62,123",tt0356618,movie,18 Jan 2005,"$66,641,205",Sony Pictures,N/A,True
Ladies in Lavender,2004,PG-13,27 May 2005,104 min,"Drama, Music, Romance",Charles Dance,"William J. Locke (short story), Charles Dance","Judi Dench, Maggie Smith, Daniel Brühl, Freddie Jones",Two sisters befriend a mysterious foreigner who washes up on the beach of their 1930's Cornish seaside village.,"English, German, Polish, French",UK,3 nominations.,"[{'Source': 'Internet Movie Database', 'Value': '7.0/10'}, {'Source': 'Rotten Tomatoes', 'Value': '64%'}, {'Source': 'Metacritic', 'Value': '61/100'}]",61,7.0,"10,156",tt0377084,movie,06 Dec 2005,"$6,492,211",IDP,N/A,True
New York Minute,2004,PG,07 May 2004,91 min,"Comedy, Crime, Family, Romance",Dennie Gordon,"Emily Fox (story), Emily Fox (screenplay), Adam Cooper (screenplay), Bill Collage (screenplay)","Ashley Olsen, Mary-Kate Olsen, Eugene Levy, Andy Richter","Two very different twin sisters haven't spent a day together in years. That changes the day they have to go to NYC and everything goes wrong - chased by a truancy officer, a killer wanting a chip back and two nice young guys.",English,USA,6 nominations.,"[{'Source': 'Internet Movie Database', 'Value': '4.9/10'}, {'Source': 'Rotten Tomatoes', 'Value': '11%'}, {'Source': 'Metacritic', 'Value': '33/100'}]",33,4.9,"20,582",tt0363282,movie,17 Aug 2004,"$14,018,364",Warner Bros.,N/A,True
Head in the Clouds,2004,R,30 Oct 2004,132 min,"Drama, Romance, War",John Duigan,John Duigan,"Charlize Theron, Penélope Cruz, Stuart Townsend, Thomas Kretschmann","From the roaring 1920s to the ruinous Spanish Civil War and Adolf Hitler's rise into power, the lives of an Irish schoolteacher, a provocative heiress and her Spanish muse are intricately interlaced, sharing the same destiny and passion.","English, German, French, Spanish","UK, Canada",6 wins & 5 nominations.,"[{'Source': 'Internet Movie Database', 'Value': '6.6/10'}, {'Source': 'Rotten Tomatoes', 'Value': '16%'}, {'Source': 'Metacritic', 'Value': '40/100'}]",40,6.6,"14,010",tt0338097,movie,25 Jan 2005,"$170,463",Sony Pictures Classics,N/A,True
,,,,,,,,,,,,,,,,,,,,,,,False
D.E.B.S.,2004,PG-13,25 Mar 2005,91 min,"Action, Comedy, Romance",Angela Robinson,Angela Robinson,"Sara Foster, Jordana Brewster, Meagan Good, Devon Aoki","Plaid-skirted schoolgirls are groomed by a secret government agency to become the newest members of the elite national-defense group, D.E.B.S.",English,USA,1 win & 2 nominations.,"[{'Source': 'Internet Movie Database', 'Value': '5.2/10'}, {'Source': 'Rotten Tomatoes', 'Value': '39%'}, {'Source': 'Metacritic', 'Value': '42/100'}]",42,5.2,"14,044",tt0367631,movie,14 Jun 2005,N/A,Destination Films,N/A,True
The Football Factory,2004,R,14 May 2004,91 min,"Crime, Drama, Sport",Nick Love,"John King (novel), Nick Love","Danny Dyer, Frank Harper, Tamer Hassan, Roland Manookian","An insight on the gritty life of a bored male, Chelsea football hooligan who lives for violence, sex, drugs & alcohol.",English,UK,1 win & 1 nomination.,"[{'Source': 'Internet Movie Database', 'Value': '6.8/10'}, {'Source': 'Rotten Tomatoes', 'Value': '38%'}]",N/A,6.8,"27,269",tt0385705,movie,26 Dec 2005,N/A,Image Entertainment,N/A,True
A Love Song for Bobby Long,2004,R,21 Jan 2005,119 min,Drama,Shainee Gabel,"Ronald Everett Capps (novel), Shainee Gabel (screenplay)","John Travolta, Scarlett Johansson, Gabriel Macht, Deborah Kara Unger",A headstrong young woman returns to New Orleans after the death of her estranged mother.,English,USA,Nominated for 1 Golden Globe. Another 2 nominations.,"[{'Source': 'Internet Movie Database', 'Value': '7.1/10'}, {'Source': 'Rotten Tomatoes', 'Value': '43%'}, {'Source': 'Metacritic', 'Value': '48/100'}]",48,7.1,"24,141",tt0369672,movie,22 Feb 2005,"$121,476",Lions Gate Releasing,N/A,True
In Good Company,2004,PG-13,14 Jan 2005,109 min,"Comedy, Drama, Romance",Paul Weitz,Paul Weitz,"Dennis Quaid, Topher Grace, Scarlett Johansson, Marg Helgenberger",A middle-aged ad exec is faced with a new boss who's nearly half his age... and who also happens to be sleeping with his daughter.,English,USA,2 wins & 8 nominations.,"[{'Source': 'Internet Movie Database', 'Value': '6.4/10'}, {'Source': 'Rotten Tomatoes', 'Value': '82%'}, {'Source': 'Metacritic', 'Value': '66/100'}]",66,6.4,"52,056",tt0385267,movie,10 May 2005,"$45,489,752",Universal Pictures,N/A,True
Exorcist: The Beginning,2004,R,20 Aug 2004,114 min,"Horror, Mystery, Thriller",Renny Harlin,"William Peter Blatty (movie The Exorcist), William Wisher (story), Caleb Carr (story), Alexi Hawley (screenplay)","Stellan Skarsgård, Izabella Scorupco, James D'Arcy, Remy Sweeney","Years before Father Lankester Merrin helped save Regan MacNeil's soul, he first encounters the demon Pazuzu in East Africa. This is the tale of Father Merrin's initial battle with Pazuzu and the rediscovery of his faith.",English,USA,6 nominations.,"[{'Source': 'Internet Movie Database', 'Value': '5.1/10'}, {'Source': 'Rotten Tomatoes', 'Value': '10%'}, {'Source': 'Metacritic', 'Value': '30/100'}]",30,5.1,"32,017",tt0204313,movie,25 Oct 2005,"$41,784,746",Warner Bros. Pictures,N/A,True
Flight of the Phoenix,2004,PG-13,17 Dec 2004,113 min,"Action, Adventure, Drama, Thriller",John Moore,"Lukas Heller, Scott Frank (screenplay), Edward Burns (screenplay)","Dennis Quaid, Tyrese Gibson, Giovanni Ribisi, Miranda Otto",Survivors of a plane crash in the Mongolian desert work together to build a new plane.,English,USA,2 nominations.,"[{'Source': 'Internet Movie Database', 'Value': '6.1/10'}, {'Source': 'Rotten Tomatoes', 'Value': '30%'}, {'Source': 'Metacritic', 'Value': '47/100'}]",47,6.1,"50,125",tt0377062,movie,01 Mar 2005,"$20,900,803",20th Century Fox,N/A,True
Twisted,2004,R,27 Feb 2004,97 min,"Crime, Drama, Mystery, Thriller",Philip Kaufman,Sarah Thorp,"Ashley Judd, Samuel L. Jackson, Andy Garcia, David Strathairn","Jessica, whose father killed her mother and committed suicide, is a police officer. While investigating a murder, she finds herself in the center of her own investigation, when her former lovers start being murdered.","English, Italian, Spanish","Germany, USA",1 win.,"[{'Source': 'Internet Movie Database', 'Value': '5.3/10'}, {'Source': 'Rotten Tomatoes', 'Value': '1%'}, {'Source': 'Metacritic', 'Value': '26/100'}]",26,5.3,"19,373",tt0315297,movie,31 Aug 2004,"$25,047,335",Paramount Pictures,N/A,True
With Blood on My Hands: Pusher II,2004,Not Rated,25 Dec 2004,100 min,"Action, Crime, Drama",Nicolas Winding Refn,Nicolas Winding Refn,"Mads Mikkelsen, Leif Sylvester, Anne Sørensen, Øyvind Hagen-Traberg","Tony is released from prison - again. This time he has his mind set on changing his broken down life, but that is easier said than done.","Danish, Serbian","Denmark, UK",3 wins & 15 nominations.,"[{'Source': 'Internet Movie Database', 'Value': '7.4/10'}, {'Source': 'Rotten Tomatoes', 'Value': '100%'}, {'Source': 'Metacritic', 'Value': '78/100'}]",78,7.4,"16,940",tt0396184,movie,07 Nov 2006,N/A,Nordisk Film Biografdistributi,N/A,True
Ginger Snaps 2: Unleashed,2004,R,30 Jan 2004,94 min,"Horror, Thriller",Brett Sullivan,"Karen Walton (characters), Megan Martin","Emily Perkins, Brendan Fletcher, Katharine Isabelle, Tatiana Maslany","Ginger's sister Brigitte, now a werewolf herself, must try to find a cure for her blood lust before the next full moon while hiding out in a rehab clinic from a relentless werewolf.",English,Canada,3 wins & 2 nominations.,"[{'Source': 'Internet Movie Database', 'Value': '6.4/10'}, {'Source': 'Rotten Tomatoes', 'Value': '88%'}]",N/A,6.4,"11,921",tt0353489,movie,13 Apr 2004,N/A,Lions Gate Films,N/A,True
Birth,2004,R,29 Oct 2004,100 min,"Drama, Fantasy, Mystery, Thriller",Jonathan Glazer,"Jean-Claude Carrière, Milo Addica, Jonathan Glazer","Nicole Kidman, Cameron Bright, Danny Huston, Lauren Bacall",A young boy attempts to convince a woman that he is her dead husband reborn.,English,"UK, France, Germany, USA",Nominated for 1 Golden Globe. Another 2 wins & 17 nominations.,"[{'Source': 'Internet Movie Database', 'Value': '6.1/10'}, {'Source': 'Rotten Tomatoes', 'Value': '38%'}, {'Source': 'Metacritic', 'Value': '50/100'}]",50,6.1,"33,240",tt0337876,movie,19 Apr 2005,"$5,005,883",New Line Cinema,N/A,True
Black Friday,2004,Not Rated,09 Feb 2007,143 min,"Action, Crime, Drama, History",Anurag Kashyap,"Anurag Kashyap (screenplay), Hussain Zaidi (book), Piyush Mishra (lyrics)","Kay Kay Menon, Pavan Malhotra, Aditya Srivastava, Dibyendu Bhattacharya","Black Friday is a film about the investigations following the 1993 serial Bombay bomb blasts, told through the different stories of the people involved --police, conspirators, victims, middlemen.",Hindi,India,2 nominations.,"[{'Source': 'Internet Movie Database', 'Value': '8.5/10'}, {'Source': 'Rotten Tomatoes', 'Value': '100%'}, {'Source': 'Metacritic', 'Value': '76/100'}]",76,8.5,"16,722",tt0400234,movie,08 Aug 1995,N/A,Passport,N/A,True
G.O.R.A.,2004,N/A,12 Nov 2004,127 min,"Adventure, Comedy, Sci-Fi",Ömer Faruk Sorak,"Can Yilmaz, Cem Yilmaz (screenplay)","Cem Yilmaz, Özge Özberk, Ozan Güven, Safak Sezer",A slick young Turk kidnapped by extraterrestrials shows his great « humanitarian spirit » by outwitting the evil commander-in-chief of the planet of G.O.R.A.,"Turkish, English",Turkey,N/A,"[{'Source': 'Internet Movie Database', 'Value': '8.0/10'}]",N/A,8.0,"50,110",tt0384116,movie,N/A,N/A,N/A,N/A,True
